Date,Time,URL,Content,Date_2,Author,Tweet_Text,Spam_Ham
,,,"Charlie, heroin will do that to you.﻿",2015-05-24T01:27:05.997,Shakeema Edwards,,ham
,,,Fruits and vegetables give you longer lasting energy for weight loss.  Check out youtube.com/user/36loseweight.,,Alex Weight-Loss,,spam
,,,Love Song﻿,2015-05-24T00:15:08.291,Karen Cervantes,,ham
,,,Megan Fox is gorg in this!! Eminem is truly the rap god :)﻿,2015-05-23T23:47:20.885,faith jones,,ham
,,,RIHANNA - POUR IT UP (VINCENT T. REMIX) RIHANNA - POUR IT UP (VINCENT T. REMIX) RIHANNA - POUR IT UP (VINCENT T. REMIX) RIHANNA - POUR IT UP (VINCENT T. REMIX) RIHANNA - POUR IT UP (VINCENT T. REMIX) RIHANNA - POUR IT UP (VINCENT T. REMIX) RIHANNA - POUR IT UP (VINCENT T. REMIX) RIHANNA - POUR IT UP (VINCENT T. REMIX) RIHANNA - POUR IT UP (VINCENT T. REMIX)  CLICK! SUBSCRIBE!,,Vincent T.,,spam
,,,Check out this video on YouTube:﻿,,Rose Bruhns,,spam
,,,He gets more views but has less subscribers lol,,..xXCoolMultiXx..,,spam
,,,Go check out eminem survival.,,ferhan kifle,,spam
,,,Hey! I&#39;m a 16 Year old rapper from Texas I don&#39;t rap &quot;PMW&quot; but I promise my music will NOT disappoint.. Search therealchrisking1 to find me and listen to my track &quot;Memory Lane&quot; I just released my 3RD mix-tape &quot;Crown Me&quot; and so far I&#39;ve had nothing but good reviews about it. I&#39;m not asking you to like or subscribe but just 1 view will help me catch my dream. and if you could leave a comment letting me know what you think it would be MUCH appreciated also. Thank you.,,Chris King,,spam
,,,if eminem gets 1 penny per view he would have 600 million dollars,,Elias Uchiha,,spam
,,,Check Out LEANDRUS - PLAYTIME It&#39;s awesoooome !!,,INCRIVELawesome,,spam
,,,Check out this video on YouTube:﻿,,Melody Peace,,spam
,,,"I know that maybe no one will read this but PLEASE TYPE IN &quot;deazy99&quot; I&#39;m a rapper with a dream. I know you must see like millions of those on here everyday but please check out my music and subscribe if you&#39;d like thank you, i would love nothing more than to have a decent following on youtube from people if anyone reading this could give it a &quot;THUMBS UP&quot; because what some might see as just a simple button press could make my dream come true..thank you again for your time &amp; may god bless you",,deazy99,,spam
,,,Dress like Rihanna at kpopcity.net - The largest discount fashion store in the world! Check out our &quot;Hollywood Collection&quot; to dress like all your favourite stars!   Dress like Rihanna at kpopcity.net - The largest discount fashion store in the world! Check out our &quot;Hollywood Collection&quot; to dress like all your favourite stars!,,Monica Lewis,,spam
,,,CHECK OUT THIS DOPE CHANNEL!    phenomenallyricshere CHECK OUT THIS DOPE CHANNEL!    phenomenallyricshere CHECK OUT THIS DOPE CHANNEL!    phenomenallyricshere CHECK OUT THIS DOPE CHANNEL!    phenomenallyricshere CHECK OUT THIS DOPE CHANNEL!    phenomenallyricshere CHECK OUT THIS DOPE CHANNEL!    phenomenallyricshere CHECK OUT THIS DOPE CHANNEL!    phenomenallyricshere CHECK OUT THIS DOPE CHANNEL!    phenomenallyricshere CHECK OUT THIS DOPE CHANNEL!    phenomenallyricshere,,Kate Mcdermit,,spam
,,,amazing song﻿,2015-05-23T22:14:55.993,Vivek Bhardwaj,,ham
,,,:)﻿,2015-05-23T19:37:52.24,kissmehk,,ham
,,,Charlie from LOST﻿,2015-05-23T17:51:58.957,Sandeep Singh,,ham
,,,SubScribe me pls EMİNEM FANS,,Dengesiz Adam,,spam
,,,dude check out psy,,Paiky MC,,spam
,,,"I love this-the talents of eminem and Skylar,works well together﻿",2015-05-23T16:41:29.823,twe enyss,,ham
,,,Share this video.. This song can beat PSY - Gangnam Style!,,FreshX,,spam
,,,thumb up if you watching in 2015 and  you like it﻿,2015-05-23T14:24:32.712,AreWEFaumos Now,,ham
,,,Check out my remix to Tyga&#39;s - Molly ft. Whiz Khalifa Peace and love,,KC Cassette,,spam
,,,Check out my channel please.,,markwardist,,spam
,,,"i been working so hard for the past 60 days to improve i been writing/recording/mixing/performing 16 bars everyday im doing it for a whole year(365 days) today i&#39;m on day 60 today i work so hard now i&#39;m doing 2 verses everyday to improve i&#39;m going all the way to 365 PLEASE SUBSCRIBE to my channel  help me build a fan base ,watch me improve,help me get closer to my dream i&#39;m lyrical and i keep it real i won&#39;t leave you down i promise(: PLEASE SUBSCRIBE please like this  commment so people can see",,Ractive,,spam
,,,I can&#39;t believe this I just now watched a brand new adult video clip with rihanna She has been screwing a black Basketball player  Check out her video right here if you wish:   crazy-celeb-news.eu.pn,,Juarez Ounfee,,spam
,,,┏━━━┓┏┓╋┏┓┏━━━┓┏━━━┓┏┓╋╋┏┓  ┃┏━┓┃┃┃╋┃┃┃┏━┓┃┗┓┏┓┃┃┗┓┏┛┃  ┃┗━━┓┃┗━┛┃┃┃╋┃┃╋┃┃┃┃┗┓┗┛┏  ┗━━┓┃┃┏━┓┃┃┗━┛┃╋┃┃┃┃╋┗┓┏┛  ┃┗━┛┃┃┃╋┃┃┃┏━┓┃┏┛┗┛┃╋╋┃┃  ┗━━━┛┗┛╋┗┛┗┛╋┗┛┗━━━┛╋╋┗┛ CHECK MY VIDEOS AND SUBSCRIBE AND LIKE PLZZ,,MrJtill0317,,spam
,,,Never gets old best song ever  ❤﻿,2015-05-23T12:12:59.082,Sawa Jamal,,ham
,,,First they were fighting... Then they were making out...﻿,2015-05-23T12:12:16.47,Fantasy Mysteries,,ham
,,,"I know that maybe no one will read this but PLEASE TYPE IN &quot;deazy99&quot; I&#39;m a rapper with a dream. I know you must see like millions of those on here everyday but please check out my music and subscribe if you&#39;d like thank you, i would love nothing more than to have a decent following on youtube from people if anyone reading this could give it a &quot;THUMBS UP&quot; because what some might see as just a simple button press could make my dream come true..thank you again for your time &amp; may god bless you",,deazy99,,spam
,,,Hey guys please just spent one minute for me:) im a singer from srilanka and im 18 year&#39;s old! SooO I LIKE TO BE GREAT SINGER will be a one day so i hope it would be happen in really my life. Just view my videos and rate it and let me know how is my voice please help us guys closer to living my dream:)! I really know you&#39;d helped me who read this comment he/she can just understand my feeling ! Thanks guys lv u really much more! SUBSCRIBE IT MY CHANNEL AND ONECE AGAIN THANK U !,,rukshan bieber,,spam
,,,YO GUYS IM 14 YEAR OLD RAPPER JUST STARTED RAPPING  SO PLEASE CHECK OUT MY SITE AND LEAVE FEEDBACK AND SUBSCRIBE  ALSO LIKE THIS COMMENT SO MORE CAN SEE AND MAKE MY CHANNEL BIG ASWELL,,Ashim Limbu,,spam
,,,Check out this video on YouTube:﻿,,Linda Dipilato,,spam
,,,*for 90&#39;s rap fans*  check out my Big Pun - &#39;Beware&#39; cover!  Likes n comments very much appreciated!,,Honest586,,spam
,,,I love this song up to the moon &gt;3 you are Rocks!﻿,2015-05-23T10:27:43.205,hazem bitar,,ham
,,,Hello. İ am from Azerbaijan<br />﻿,2015-05-23T08:55:42.007,Ferhad Babayev,,ham
,,,"This great Warning will happen soon. ,0
LneaDw26bFst76VHKJL8PxaEy6VMNlvmriUDTSFK6vY,Ali Paša,2013-09-26T22:28:17.047000,Croatia &lt;3,0
LneaDw26bFvkAHxpKEnM25FYWkyXthsUpri6JuQsZnU,G Belrus,2013-09-26T22:26:12.832000,Nice one,0
LneaDw26bFtvZQt6JUEhasIEFRJG1exI_dVqdnQVPho,exode. comeback.,2013-09-26T22:23:00.710000,600m views.,0
LneaDw26bFunOarAg71AwGU6TJO6aZDKFIUn_TZ1_HY,Muhammad Shaeel Abbas,2013-09-26T22:15:45.476000,Fuck off!,0
LneaDw26bFt-oToUFj0z3vffLFNaxyKwZSIVQhiMx-E,Notorious Niko,2013-09-26T22:00:43.613000,""Hey guys im a 17yr old rapper trying to get exposure... I live in belgium where NO ONE speaks english so i have to resort to this gay SPAM...  Check out my 2 latest tracks as they are probably my best.. Audio isnt the best but im gonna invest in some real equipment for my next track..  Please Thumbs this up so others can see.. or hey dont just check me out yourself and leave a response and a like :D  Thanks in advance, you guys will be part of making my dream come TRUE   -Notorious Niko ",,이 정훈,,spam
,,,"Hey guys im a 17yr old rapper trying to get exposure... I live in belgium where NO ONE speaks english so i have to resort to this gay SPAM...  Check out my 2 latest tracks as they are probably my best.. Audio isnt the best but im gonna invest in some real equipment for my next track..  Please Thumbs this up so others can see.. or hey dont just check me out yourself and leave a response and a like :D  Thanks in advance, you guys will be part of making my dream come TRUE   -Notorious Niko ",,Notorious Niko,,spam
,,,EMINEM&lt;3 <br />the best rapper ever&lt;3﻿,2015-05-23T08:36:40.952,Boksu Boc,,ham
,,,i hate rap﻿,2015-05-23T07:17:09.691,Chelsea Yun,,ham
,,,Check out my channel to see Rihanna short mix by me :),,media.uploader,,spam
,,,Every weekend a new lyric video of Eminem here VIEW LIKE SUBSCRIBE,,Anthony Konstantinou,,spam
,,,This song/video is such a trigger but it&#39;s just so good...﻿,2015-05-23T05:14:55.214,Laura Winner,,ham
,,,Check Out The New Hot Video By Dante B Called Riled Up,,DanteBTV,,spam
,,,Was that Meghan fox??﻿,2015-05-23T04:45:12.703,LUKAZ G,,ham
,,,ayyy can u guys please check out my rap video im 16 n im juss tryna get some love please chrck it out an thank u,,armontre,,spam
,,,COME SUBSCRIBE TO MY CHANNEL! ;-)  PLEASE!!,,Jay Stevens,,spam
,,,"Awesome song!,congratulations!!!﻿",2015-05-23T04:15:02.178,Maria Montana,,ham
,,,"Come check out our music channel! go check out the song &quot;Love Me&quot; by J.E.M.INI! If you do you are a very amazing person, thank you to all who check it out, if you don&#39;t check it out you&#39;re still an amazing person just for reading this post",,BloodspitsMusic,,spam
,,,share and like this page to win a hand signed Rihanna photo!!! fb -  Fans of Rihanna,,janez novak,,spam
,,,share and like this page to win a hand signed Rihanna photo!!! fb -  Fans of Rihanna,,janez novak,,spam
,,,check out my page ADAM B BEATS 2013,,Adam B,,spam
,,,Look and shares my video please :D,,HEADSHOT946,,spam
,,,Check out this video on YouTube:﻿,,Rose Bruhns,,spam
,,,Like &amp; Subscribe /watch?v=5tu9gN1l310,,Noise​Break,,spam
,,,charlieee :DDDD (Those who saw Lost only will understand)﻿,2015-05-23T02:32:21.664,PDV10,,ham
,,,LADIES!!! -----&gt;&gt; If you have a broken heart or you just want to understand guys better you should check out this underground book called The Power of the Pussy on AMAZON. Best book ever for us girls! Oh...and just a warning it&#39;s for 18 and over...lol,,miamiscraziest,,spam
,,,COFFEE ! LOVERS ! PLEASE ! READ ! Check out a song I wrote and sing on You Tube called COFFEE LOVA.Type COFFEE LOVA like I spell it while your already on You Tube hit enter.Then look for video titled COFFEE LOVA hit enter and BLAST ! OFF !,,Ked Woodly,,spam
,,,"hey guy if you can please SUBSCRIBE to my channel im a young dedicated rapper i post videos everyday to improve  i write/perform/record/mix/edit/post everyday  i do a verse everyday (16 bars)to improve i&#39;m doing it for 365 days a whole year to improve right now i&#39;m on day 46  if you guys can please like this comment so everyone can see it and follow me on my journey/watch me improve everyday SUBSCRIBE PLEASE I&#39;m lyrical and i keep it real  help me reach my dream,help me build a fan base,THANKS(:",,Ractive,,spam
,,,so many comments.﻿,2015-05-23T02:13:21.735,dmrc43,,ham
,,,"Getting too 1billion views, holy moly.!!!﻿",2015-05-23T02:13:15.643,Unitedstates America,,ham
,,,Best song﻿,2015-05-23T01:14:31.812,Kate Love,,ham
,,,SUBSCRIBE TO ME! I MAKE MUSIC!,,FaZe MinEz,,spam
,,,#1 song in world even in 2015﻿,2015-05-22T23:24:03.588,Nader sheckler,,ham
,,,Hi loving it﻿,2015-05-22T22:36:11.416,Lily Barboza,,ham
,,,subscribe me if u love eminem,,Amir bassem,,spam
,,,Lol thats the guy from animal planet and lost. And the girl is megan fox i think hahah ﻿,2015-05-22T22:19:43.707,Elsa Ekokobe Rønning,,ham
,,,This song is true because it is insane because boys will do this to a girl and it is not true that people say that a guy will never do it to a girl but boys YOU LIERS NOW STOP TREATING US GIRLS THIS WAY YOU ALL SUCK!﻿,2015-05-22T16:01:46.636,Angie Schear,,ham
,,,Love the video ﻿,2015-05-22T14:44:13.619,Aleesha Hoover,,ham
,,,Hello I&#39;m from Bulgaria﻿,2015-05-22T13:13:00.927,Manikencheto Metodiev,,ham
,,,if u love rihanna subscribe me,,Amir bassem,,spam
,,,Eminem rap can be easy for a boy but I can do that﻿,2015-05-22T12:37:59.803,Laighla Owens-Teague,,ham
,,,if u love rihanna subscribe me,,Amir bassem,,spam
,,,CHECK OUT MY MUSIC VIDEO ON MY CHANEL!!!,,Jason Viens,,spam
,,,check out our bands page on youtube killtheclockhd - check out some of our original songs including &quot;your disguise&quot;,,killtheclockhd,,spam
,,,could you guys please check out my channel for hiphop beats?,,LaMusician,,spam
,,,I love this song sooooooooooooooo much﻿,2015-05-22T11:46:35.988,Sonny Carter,,ham
,,,everyone come and check out the new GTA 5 Gameplay right Here : /watch?v=6_H0m5sAYho,,Terry-Lee Mackenney,,spam
,,,Check out this video on YouTube:﻿,,Amie Rutledge,,spam
,,,Hey guys I&#39;m 87 cypher im 11 years old and Rap is my life I recently made my second album desire ep . please take a moment to check out my album on YouTube thank you very much for reading every like comment and subscription counts,,Drake Gagne,,spam
,,,Eminem - Love the way you lie ♥ ♥ ♥﻿,2015-05-22T10:58:24.072,Angie Medina,,ham
,,,Hey guys ready for more 87 Cyphers back check out my video on YouTube. NEW ALBUM IS OUT CHECK IT OUT. MORE MUSIC TOMORROW THANKS FOR READING,,Drake Gagne,,spam
,,,Hey if you guys wouldnt mind...could you check out my boys and my music...we just made a real lyrical song...search DNA Andrew Guasch...I appreciate it. Leave some real feedback and keep Hip-Hop alive,,Andrew Guasch,,spam
,,,Is that girl is Megan fox ﻿,2015-05-22T09:38:22.793,Intan  Nadia,,ham
,,,So freaking sad...﻿,2015-05-21T22:48:59.766,Quinn and Mia Channel MattyB101,,ham
,,,Hello. I only made ONE Eminem song on my channel. Could you guys just put A LIKE on it please? Don&#39;t need to subscribe. Thanks.,,Butter Forbes,,spam
,,,"hey guys if you guys can please SUBSCRIBE to my channel ,i&#39;m a young rapper really dedicated i post a video everyday ,i post a verse (16 bars)(part of a song)everyday to improve i&#39;m doing this for 365 days ,right now i&#39;m on day 41  i&#39;m doing it for a whole year without missing one day if you guys can please SUBSCRIBE and follow me on my journey to my dream watch me improve, it really means a lot to me  thank you (:, i won&#39;t let you down i promise(: i&#39;m lyrical i keep it real!",,Ractive,,spam
,,,hey its M.E.S here I&#39;m a young up and coming rapper and i wanna get my music heard i know spam wont get me fame. but at the moment i got no way of getting a little attention so please do me a favour and check out my channel and drop a sub if you enjoy yourself. im just getting started so i really appreciate those who take time to leave constructive criticism i already got 200 subscribers and 4000 views on my first vid ive been told i have potential,,M.E.S,,spam
,,,i like the lyrics but not to music video﻿,2015-05-21T22:35:35.753,viviane trinh,,ham
,,,"I hope everyone is in good spirits I&#39;m a hard working student who&#39;s also a passionate singer I look foward to the day when I can make my own music to share But for now I&#39;ve just been doing covers. Check out my channel, I&#39;ve done Covers of Miley Cyrus, Imagine Dragons, Lana Del Rey, Drake, Macklemore, Pink and countless others.  Subscribe only if you want to. My goal isn&#39;t to become famous but to  inspire FYI this isn&#39;t spamming, everyone has a right to freedom of speech. Thanks ",,Greg Fils Aimé,,spam
,,,check out my channel for rap and hip hop music,,rap classics,,spam
,,,BR﻿,2015-05-21T21:54:55.768,France Silva,,ham
,,,adam b beats check out my page,,Adam B,,spam
,,,"<a rel=""nofollow"" class=""ot-hashtag"" href=""https://plus.google.com/s/%23Awesome"">#Awesome</a> <a rel=""nofollow"" class=""ot-hashtag"" href=""https://plus.google.com/s/%23Share"">#Share</a> <a rel=""nofollow"" class=""ot-hashtag"" href=""https://plus.google.com/s/%23RT"">#RT</a> Eminem - Love The Way You Lie ft. Rihanna <a href=""http://ow.ly/2zME8f"">http://ow.ly/2zME8f</a>﻿",,Andrew Willigar,,spam
,,,im M.E.S an aspiring young rapper with high hopes.  i know you will not click this link and check out my channel. you just dont want to.  well its your choice. in fact you know what DONT CLICK,,M.E.S,,spam
,,,Looooved ﻿,2015-05-21T21:34:27.615,Huda Salah,,ham
,,,We need to get this to 1 Billion Views!!﻿,2015-05-21T20:37:21.421,SBG | Zombies,,ham
,,,"Hey? Everyone Please take a moment to read this. I work my ass off hoping to make it into the music industry but its hard to? get people to hear you when you don’t have money for advertisements and exposure I am a Young Artist who has dreams and goals like everybody else Please take 30 seconds and visit my channel You don’t have to like? me, just give me a chance to prove my talent Also, please take just 1 second of your life and Thumb this comment up it would be Super Helpful.",,superfacoo,,spam
,,,Amazing﻿,2015-05-21T20:04:42.844,Seth Ryan,,ham
,,,Almost a billion﻿,2015-05-21T20:04:36.016,Seth Ryan,,ham
,,,Great song﻿,2015-05-21T20:04:26.473,Seth Ryan,,ham
,,,PLEASE CHECK OUT MY VIDEO CALLED &quot;WE LOVE MIND MASTER IT&quot; THANKS,,Lizzy Molly,,spam
,,,Okay trust me I&#39;m doing a favor. You NEED to check out this guy named Columbus Nelson on YouTube.,,marion guy,,spam
,,,I agree they are just damn spammers. They suck. Im trying to do the same and get known. I know the feeling. I will help you out and leave likes and comments on your page. I hope you could do the same and maybe subscribe to me that would be awesome thanks,,diabeat diaBEAT,,spam
,,,adam b beats check out my page 2013,,Adam B,,spam
,,,CHECK OUT THESE LYRICS /watch?v=yUTTX04oyqQ,,Domen Kristan,,spam
,,,"I don&#39;t understand this song, I have had the passion for women feel like im losing my mind but i don&#39;t understand the ideas of loving the the way someone lies.....﻿",2015-05-21T19:57:17.18,scott boshaw,,ham
,,,*****PLEASE READ*****  Hey everyone! I&#39;m a 19 year old student  who loves to sing.  I record and upload covers on my channel. I would love if you could check them out.  Just give me a chance. You don&#39;t have to thumbs up or subscribe (But you can if you like what your hear)  Just listen. I&#39;d really appreciate.  ~THANK YOU for your time. ~,,Chelsea Cameron,,spam
,,,Anybody else here in 2015?﻿,2015-05-21T18:52:17.472,Juan Aimar,,ham
,,,"Hi I&#39;m lil m !!! Check out love the way you lie!!!! My live performance and many others,,, videos and my own lyrics!!!!! Thanks",,Lil M,,spam
,,,I&#39;m subscribing to you just because your comment was that great.,,AdmiralMusclebeard,,spam
,,,I like the Mmph version better﻿,2015-05-21T18:44:38.982,Smitty Werben Jaggerman Jensen,,ham
,,,Terrance. .thank you for serving our country. How do i &quot;like you&quot; or &quot;subscribe&quot;?,,Kate Hermamn,,spam
,,,Thumbs up if you listen this in 2015.﻿,2015-05-21T18:34:39.389,Gergő “Vlog14” Csatornája,,ham
,,,Hey everyone check out my channel leave a like and subscribe please and if there is a song you want me to do post the name in the comments and I will get on to it(: Thanks,,Brandon Thaler,,spam
,,,do you want to make some easy money? check out my page tvcmcadavid.weebly . com dont miss out on this opportunity,,david rodriguez,,spam
,,,Hi everyone. We are a duo and we are starting to record freestyles and put them on youtube. If any of you could check it out and like/comment it would mean so much to us because we love doing this. We may not have the best recording equipment but if you listen to our lyrics and rhymes I think you&#39;ll like it. If you do then please subscribe and share because we love making these videos and we want you to like them as much as possible so feel free to comment and give us pointers! Thank you!,,Dominic Randall,,spam
,,,For all you ladies out there......  Check out this link!  You&#39;ll find the hottest hairstyles and the latest trends for women!  Go to this site and you&#39;ll upgrade your hairstyles and fashion senses to a higher level!  Don&#39;t get left behind!     ---&gt;   goo.gl\BxrOSR,,Unbeweavable Co,,spam
,,,Hi I am from bangladesh 💜﻿,2015-05-21T18:24:19.018,faisal joy,,ham
,,,Is that Megan Fox?﻿,2015-05-21T18:00:06.674,Ala Fatah,,ham
,,,Fire..﻿,2015-05-21T17:41:48.433,T MAN,,ham
,,,EMINEM FANS!!!  - Check Out The New Song &quot;FEELIN&#39; GOOD&quot; By J-D-P  Just Click The &quot;GHOSTPOET100&quot; Link Above This Post  Thank You All...,,GhostPoet100,,spam
,,,Hi Guys im an Upcoming Rapper if you could check out my channel and tell me what you think maybe subscribe or like i would really appreciate it all HATERS are welcome to :) thanks,,Terry-Lee Mackenney,,spam
,,,"CHECK OUT THIS NEW VIDEO I MADE CALLED &quot;WE LOVE MIND MASTER IT&quot;, THANK U SO MUCH ",,Tiffanythebest,,spam
,,,I love the way you lie﻿,2015-05-21T16:53:59.328,Gail Weir,,ham
,,,hey its M.E.S here I&#39;m a young up and coming rapper and i wanna get my music heard i know spam wont get me fame. but at the moment i got no way of getting a little attention so please do me a favour and check out my channel and drop a sub if you enjoy yourself. im just getting started so i really appreciate those who take time to leave constructive criticism i already got 200 subscribers and 4000 views on my first vid ive been told i have potential,,M.E.S,,spam
,,,Love the way you lie II is nicer in my opinion. :D﻿,2015-05-21T15:55:45.911,Chris Bieber,,ham
,,,Almost to a billion :)﻿,2015-05-21T15:03:22.787,Levi Cole,,ham
,,,If you are a person that loves real music you should listen to &quot;Cruz Supat&quot;<br />He is awesome as fuck!!! Just as eminem used to be.﻿,2015-05-21T14:36:34.512,Ashley Jsade,,ham
,,,Also check out D.j.j where do i go now and road to recovery,,Josh Dummett,,spam
,,,Charlie got off the island and dated Megan Fox? b-but what about claire?﻿,2015-05-21T12:41:55.505,Furashious,,ham
,,,Hi guys ! !  Check Out My Remixes ! !  Thanx You&#39;re Great ! ! SWAG ! !,,Davide Puzzanghera,,spam
,,,"Please check out my youtube channel! Just uploaded my first youtube video please check it out, you will not regret it!",,AvidorFilms,,spam
,,,Eminem best rapper all the time﻿,2015-05-21T11:46:27.413,nepart maxx,,ham
,,,Omg! This guy sounds like an american professor green﻿,2015-05-21T11:12:22.066,Paul Buxton,,ham
,,,thumbs up if you think this should have 1 billion views﻿,2015-05-21T09:48:06.926,vZoqwa,,ham
,,,Lemme Top Comments Please!!﻿,2015-05-21T09:19:36.091,Vence Cerbo,,ham
,,,i love this song﻿,2015-05-21T05:12:43.987,liu hui (dukegod),,ham
,,,My favorite song 💗💗💗💗﻿,2015-05-21T04:46:05.79,Emma Halbrook,,ham
,,,tryna work with some rappers check out the ones i already have on my channel,,Beats ProdByATHS,,spam
,,,Check out Berzerk video on my channel ! :D,,RaMpAgE420,,spam
,,,super﻿,2015-05-21T02:11:54.71,Andrés Nuñez,,ham
,,,eminem new song check out my videos,,Stricker Stric,,spam
,,,Check out this video on YouTube:﻿,,Susan Ambs,,spam
,,,"My friends wife earns 4000DOLLARS a month ,you can do it do if you want to be a wwhore ,you can not get these type of wages for working from home on a PC taking surveys ...dont believe that shit,just because yahoo and other are taking their money does not mean they are LEGIT ..Please like this so the MSG gets thru to vulnerable  people Like eminem used to be ",,arrgh garry,,spam
,,,Subscribe To Mê Please Guys,,RapStarz Coleman,,spam
,,,"this is the 4th most watched video on youtube. and hes the 21 most subscribed channel on youtube, just recentley surpassing justing bieber and is less then 1,00 subs away from beating taylor swift",,Nicholas Reed,,spam
,,,hey its M.E.S here I&#39;m a young up and coming rapper and i wanna get my music heard i know spam wont get me fame. but at the moment i got no way of getting a little attention so please do me a favour and check out my channel and drop a sub if you enjoy yourself. im just getting started so i really appreciate those who take time to leave constructive criticism i already got 200 subscribers and 4000 views on my first vid ive been told i have potential,,M.E.S,,spam
,,,Love you﻿,2015-05-21T01:06:57.289,Carolina Sanchez Cifuentes,,ham
,,,Lil m !!!!! Check hi out!!!!! Does live the way you lie and many more ! Check it out!!! And subscribe,,Lil M,,spam
,,,"Hello to everyone! Please check out my video: /watch?v=2b4WyWpHi8c It takes just 2 minutes, hope I don&#39;t ask too much. If you can&#39;t help me just Like &amp; Share the video please, so more people will see it. Thumbs UP, it would mean so much to me, maybe will make my dream come true. Thanks to everyone, GOD BLESS YOU ALL!",,HOTFUZZOFFICIAL,,spam
,,,/watch?v=aImbWbfQbzg watch and subscrible,,Nikola Vejionvic,,spam
,,,I  love you Eminem﻿,2015-05-21T01:05:43.761,Jp Galeanoo,,ham
,,,love the you lie the good﻿,2015-05-20T23:44:25.92,geraldine lopez,,ham
,,,still listening in 2015﻿,2015-05-20T22:58:46.199,Daniel Tabatabai,,ham
