Date,Time,URL,Content,Date_2,Author,Tweet_Text,Spam_Ham
,,,SUB 4 SUB PLEASE LIKE THIS COMMENT I WANT A SUCCESFULL YOUTUBE SO PPLEASE LIKE THIS  COMMENT AND SUBSCRIBE IT ONLY TAKES 10 SECONDS PLEASE IF YOU SUBSCRIBE ILL  SUBSCRIBE BACK THANKS﻿,2014-01-19T17:20:58,HamzaMurt | Advanced Warefare | Lets Play!,,
,,," Hey everyone!! I have just started my first YT channel i would be grateful  if some of you peoples could check out my first clip in BF4! and give me  some advice on how my video was and how i could improve it. ALSO be sure to  go check out the about to see what Im all about. Thanks for your time :) .  and to haters... You Hate, I WIN﻿",2014-01-19T17:25:23,ii Trollercopter,,
,,,"The projects After Effects, Music, Foto, Web sites and another you can find  and buy here  http://audiojungle.net/user/EugeneKalinin/portfolio?ref=EugeneKalinin﻿",2014-01-19T19:21:04,Eugene Kalinin,,
,,,YouTube/codytolleson for awesome videos I'll subscribe back ﻿,2014-01-20T02:50:44,Cody Tolleson,,
,,,if you like roblox minecraft world of warcraft gta5 mario suscribe to my  channel﻿,2014-01-20T04:45:34,cake cat,,
,,,SUBSCRIBE TO ME AND I'LL SUBSCRIBE TO YOU! (Must like - cZFcxsn0jnQ) ﻿,2014-01-20T06:16:28,World327RS,,
,,,http://www.twitch.tv/jaroadc come follow and watch my stream!﻿,2014-01-20T06:57:25,Didier Drogba,,
,,,"if you like raw talent, raw lyrics, straight real hip hop Everyone check my newest sound  Dizzy X - Got the Juice (Prod by. Drugs the Model Citizen)   COMMENT TELL ME WHAT YOU THINK  DONT BE LAZY!!!!  - 1/7 Prophetz﻿",2014-01-20T09:08:39,MFkin PRXPHETZ,,
,,,....subscribe......  ......to my........  .....channel.......﻿,2014-01-20T10:12:07,Dave X,,
,,,"now its 1,884,034,783 views! pls. comment the view count the next hour :P﻿",2014-01-20T13:03:12,crestpee,,
,,,http://www.avaaz.org/po/petition/Youtube_Corporation_Fox_Broadcasting_Company_Anular_os_strikes_no_Canal_Nostalgia/?cXPZpgb ﻿,2014-01-20T15:10:27,Leonardo Baptista,,
,,,go here to check the views :3﻿,2014-01-20T15:27:47,Phuc Ly,,
,,,thumbs up if u checked this video to see hw views it got﻿,2014-01-20T16:15:09,Milan George,,
,,,Plz subscribe to my channel and I will subscribe back xx﻿,2014-01-20T16:41:27,Kirsty Brown,,
,,,i check back often to help reach 2x10^9 views and I avoid watching Baby﻿,2014-01-20T17:08:37,Kochos,,
,,,This video will get to 2 billion just because of people checking if it has  hit 2 billion yet.﻿,2014-01-20T17:22:53,eSkiip,,
,,,https://www.facebook.com/pages/Brew-Crew-2014/134470083389909 Like this  facebook-page! Chance to win an Iphone 5S!﻿,2014-01-20T17:29:52,Wumrogue lite,,
,,,get GWAR to play 2015 superbowl  http://www.change.org/petitions/the-national-football-league-allow-gwar-to-perform-the-2015-super-bowl-halftime-show#share ﻿,2014-01-20T17:58:46,Ruddy Tapia,,
,,,Pls follow this channel!! http://www.twitch.tv/sevadus﻿,2014-01-20T18:52:12,Artsi,,
,,,hi guys check my youtube channel﻿,2014-01-20T20:00:55,ProsGamerOnly,,
,,,Subscribe and like to me for more how to videos on minecraft!﻿,2014-01-20T20:23:35,JP Jochem,,
,,,http://tankionline.com#friend=cd92db3f4 great game check it out!﻿,2014-01-20T20:35:56,Jdidk Loma,,
,,,Subscribe ME!﻿,2014-01-20T21:11:52,BaconBro HD,,
,,,Im just to check how much views it has﻿,2014-01-20T22:20:59,Eanna Cusack,,
,,,The first comment is chuck norrus ovbiously :D﻿,2014-01-21T02:09:22,fastestghost,,
,,,Behold the most viewed youtube video in the history of ever﻿,2014-01-21T02:29:43,StuntmanGaming,,
,,,when is this gonna hit 2 billion?﻿,2014-01-21T03:16:46,Master Chief,,
,,,the most viewed youtube video of all time?﻿,2014-01-21T03:18:31,David Bell,,
,,,"969,210 dislikes like dislike themselves﻿",2014-01-21T07:33:30,virgie natividad,,
,,,psy=korean﻿,2014-01-21T08:22:06,asd ad,,
,,,"OMG this oldspice spraytan party commercial omg....i'm sitting here ""NO  this isn't a real thing is it? OMG"" ﻿",2014-01-21T09:03:36,Dymetex,,
,,,"This is the only video on youtube that get so much views just because we  want to see how much views it has. 1.000.000 every day, I mean, Most people  think a video is popular when it actually gets 1.000.000 views.﻿",2014-01-21T13:39:13,MrTuizentfloot,,
,,,It's been back for quite a while now.,2014-01-25T19:36:25,OREOGAM3R,,
,,,2 Billions in 2014,2014-01-27T19:36:00,LEONARDO CAETANO,,
,,,plz check out fablife / welcome to fablife for diys and challenges so plz  subscribe thx!﻿,2014-11-02T00:48:57,fab life,,
,,,Sub my channel!﻿,2014-11-02T01:08:10,Oh 1080s,,
,,,http://www.ebay.com/itm/131338190916?ssPageName=STRK:MESELX:IT&amp;_trksid=p3984.m1555.l2649 ﻿,2014-11-02T05:06:46,Ariel Baptista,,
,,,http://www.guardalo.org/best-of-funny-cats-gatti-pazzi-e-divertenti-2013-5287/100000415527985/ ﻿,2014-11-02T12:04:36,Stefano Albanese,,
,,,"if your like drones, plz subscribe to Kamal Tayara. He takes videos with  his drone that are absolutely beautiful.﻿",2014-11-02T14:33:30,Salim Tayara,,
,,,http://hackfbaccountlive.com/?ref=4604617﻿,2014-11-02T14:53:06,Lucky D.,,
,,,"WHATS UP EVERYONE!? :-) I Trying To Showcase My Talent To The World! I Have Over 3000 SUBSCRIBERS! I PROMISE! I Dont Suck! Please Spread My Covers Around, SUBSCRIBE &amp; Share! Thanks so much for all your support! Lucas Trigo -Stay Awesome! ﻿",2014-11-02T15:52:22,Lucas Trigo,,
,,,-----&gt;&gt;&gt;&gt;  https://www.facebook.com/video.php?v=10200253113705769&amp;set=vb.201470069872822&amp;type=3&amp;permPage=1  &lt;--------﻿,2014-11-02T16:17:11,TheHariiiii,,
,,,"Hi there~I'm group leader of Angel, a rookie Korean pop group. We have four  members, Chanicka, Julie, Stephanie, and myself, Leah. Please feel free to  check out our channel and leave some feedback on our cover videos (:  criticism is welcome as we know we're not top notch singers so please come  leave some constructive feedback on our videos; we appreciate any chance to  improve before auditioning for a Korean management company. We plan on  auditioning for JYP, BigHit, Jellyfish, YG or SM. Thank you for taking time  out of your day to read this !﻿",2014-11-02T17:27:09,Angel,,
,,,http://woobox.com/33gxrf/brt0u5 FREE CS GO!!!!﻿,2014-11-02T18:34:03,Squir3,,
,,,Admit it you just came here to check the number of viewers ﻿,2014-11-02T20:00:37,Kaya Roberts,,
,,,"Just coming to check if people are still viewing this video. And  apparently, they still do.﻿",2014-11-02T22:48:21,Prim N.,,
,,,Check my first video out﻿,2014-11-02T23:25:44,James Ridge,,
,,,Check my channel﻿,2014-11-03T14:38:53,Minecraft-Viasat,,
,,,PSY - GANGNAM STYLE (강남스타일) M/V: http://youtu.be/9bZkp7q19f0﻿,2014-11-03T16:43:36,Alessio Siri,,
,,,Suscribe My Channel Please XD lol﻿,2014-11-03T17:39:07,Backup Plus,,
,,,Wow. Comments section on this still active. Not bad. Also 5277478 comments.  (Now 79)﻿,2014-11-03T19:09:40,Almighty Toffeebomb,,
,,,http://binbox.io/1FIRo#123﻿,2014-11-03T20:32:26,Meth Lover,,
,,,Ching Ching ling long ding ring yaaaaaa Ganga sty FUCK YOU.﻿,2014-11-03T20:41:23,NstyIC Gold,,
,,,https://www.indiegogo.com/projects/cleaning-the-pan--2    please halp me  with my project﻿,2014-11-03T21:38:17,Никита Безухов,,
,,,There is one video on my channel about my brother...﻿,2014-11-03T22:22:14,Михаил Панкратов,,
,,,"Check my channel, please!﻿",2014-11-03T22:28:56,Angek95,,
,,,"Does anyone here use gift cards like Amazon, itunes, psn, google play,  itunes, or any other gift cards? Then you'll be happy to know you can get  free gift card codes for free from an amazing site. Here is a $50 itunes  gift card code XXBB5TCZHM39HVZD﻿",2014-11-03T23:02:47,Arianna Leighton,,
,,,Why does this video have so many views? Because asian things are awesome and non-asian countries are jelly so they  try to learn from asia by looking at this video d:﻿,2014-11-03T23:03:03,richardex8,,
,,,Plizz withing my channel ﻿,2014-11-03T23:29:00,Олег Пась,,
,,,I made a gaming channel (Unique right?) :L Angry Minecraft!﻿,2014-11-04T00:00:57,Crooked Gaming,,
,,,Please help me go here http://www.gofundme.com/littlebrother﻿,2014-11-04T00:18:07,Monwar Sarkar,,
,,,Anybody who subscribes to me will get 10 subscribers﻿,2014-11-04T02:00:14,Jack ToadROXMK,,
,,,http://thepiratebay.se/torrent/6381501/Timothy_Sykes_Collection﻿,2014-11-04T02:22:06,roflcopter2110,,
,,,"My videos are half way decent, check them out if you want.﻿",2014-11-04T03:12:23,Imprezzi Vidzz,,
,,,"they said this video are not deserve 2billion views , while they keep  visiting it to watch the viewer . ﻿",2014-11-04T07:37:28,khir abqari,,
,,,subscribe to itz recaps and above diddle﻿,2014-11-04T11:38:51,Gloria Garcia,,
,,,Screw this Chinese crap i dont even understand what he is saying. Why isn't  he speaking English like everyone should?﻿,2014-11-04T12:40:15,xSparkShark,,
,,,need money?Enjoy https://www.tsu.co/emerson_zanol﻿,2014-11-04T13:48:04,Emerson Zanol Zanol,,
,,,Sub to my channel visuelgamingzNL I sub back﻿,2014-11-04T13:54:25,Lars Zaadstra,,
,,,please subscribe i am a new youtuber and need help please subscribe and i  will subscribe back :D hoppa HOPPA GaNgAm StYlE﻿,2014-11-04T14:38:42,firo mota,,
,,,sub me if you dont like the song﻿,2014-11-04T18:00:07,Connor Groom,,
,,,This is a weird video.﻿,2014-11-04T18:09:18,Kaiser Dragon,,
,,,8 million likes xD even the subscribers not 8 million xD﻿,2014-11-04T18:30:39,Monster Sifou,,
,,,EHI GUYS CAN YOU SUBSCRIBE IN MY CHANNEL? I AM A NEW YOUTUBER AND I PLAY  MINECRAFT THANKS GUYS!... SUBSCRIBE!﻿,2014-11-04T19:46:38,TIGERIO_,,
,,,Hi everyone! Do you like music? Then why not check out my music channel.  The LEXIS band will be uploading their own songs and covers soon so don't  miss out. Please SUBSCRIBE too as it does help us out a lot. Just takes one  click. -&gt;﻿,2014-11-04T20:22:21,OFFICIAL LEXIS,,
,,,This song never gets old love it.﻿,2014-11-04T22:07:22,trespasser4000,,
,,,gofundme.com/grwmps﻿,2014-11-05T00:21:29,Pat M,,
,,,"Hey guys please check out my new Google+ page it has many funny pictures,  FunnyTortsPics  https://plus.google.com/112720997191206369631/post﻿",2014-11-05T01:13:43,Malin Linford,,
,,,#2012bitches﻿,2014-11-05T06:34:19,kenny clayton,,
,,,Made in china....﻿,2014-11-05T07:01:34,Akymonix,,
,,,5 milions comentars and 2 bilion views﻿,2014-11-05T07:48:10,Gaming Land,,
,,,It is 0 zero﻿,2014-11-05T07:49:21,tom hawksbee,,
,,,Mix - PSY - GANGNAM STYLE (강남스타일) M/V: PSY - GANGNAM STYLE (강남스타일) M/V﻿,2014-11-05T08:12:06,Norman Reid,,
,,,This has had over 2 billion views.  Holy shit.﻿,2014-11-05T08:42:06,Emily Hamilton,,
,,,"how can there be 2.124.821.694 views, when im the only person alive after  the zombie apocalypse - greetings, spoderman :)﻿",2014-11-05T10:43:27,rolle54100,,
,,,Suscribe my channel please﻿,2014-11-05T15:10:43,MrBrunoExtreme,,
,,,"2,124923004 wiews... wow﻿",2014-11-05T15:25:34,xMasterGGx,,
,,,guys please subscribe me to help my channel grow please guys﻿,2014-11-05T15:27:34,pro stomper,,
,,,Great music anyway﻿,2014-11-05T15:28:28,Abdinasir Omar,,
,,,PSY - GANGNAM STYLE (강남스타일) M/V: http://youtu.be/9bZkp7q19f0﻿,2014-11-05T15:35:49,Aleksaivan Neidert,,
,,,"so crazy, over 2 billion views, not US, not Uk, its Korea republic, its  asia﻿",2014-11-05T15:38:10,Luat ha hpuoc,,
,,,Discover a beautiful song of A young Moroccan     http://www.linkbucks.com/AcN2g﻿,2014-11-05T16:12:51,abdellah chafouai,,
,,,"Like getting Gift cards..but hate spending the cash.... Try Juno Wallet !!! At Juno Wallet you can earn money for gift cards such as ; Nike, Gamestop,  Amazon , Ebay Etc &amp; its easy  Earn money by doing simple task like watching videos..downloading apps &amp;  you can even earn money by inviting your friends to join...its free for  signup Sign up today &amp; use promo code BD3721315﻿",2014-11-05T16:18:58,Brotha B,,
,,,Can somebody wake me up when we get to 3 billion views.﻿,2014-11-05T17:18:14,Amir effect,,
,,,PSY GOT LOTS  OF MONEY FROM YOUTUBE THAT HE GOT FROM 2 BILLION VIEWS THIS  IS THE MOST VIEWS IN THE WORLD :D﻿,2014-11-05T18:02:31,lakis constantinou,,
,,,Justin bieber = gay ﻿,2014-11-05T18:05:17,just a filthy kafir,,
,,,You gotta say its funny. well not 2 billion worth funny but still. It  clicked and everything went uphill. At least you don't have JB's shit on  #1.﻿,2014-11-05T18:16:55,HarveyIsTheBoss,,
,,,❤️ ❤️ ❤️ ❤️ ❤️❤️❤️❤️﻿,2014-11-05T19:51:38,M7AMDksa,,
,,,"Ahhh, 2 years ago....﻿",2014-11-05T20:15:09,Noah François,,
,,,"Dance dance,,,,,Psy  http://www.reverbnation.com/msmarilynmiles﻿",2014-11-05T20:19:26,Neely Nesley,,
,,,"check out ""starlitnightsky"" channel to see epic videos﻿",2014-11-05T20:33:15,BmwManDexter,,
,,,https://www.tsu.co/KodysMan plz ^^﻿,2014-11-05T21:10:09,KodysMan Dunt Know,,
,,,Stupid people... this video doesnt have 2 billion visits. Have 2 thousands  millions﻿,2014-11-05T21:14:36,nachopinca3901,,
,,,http://www.gcmforex.com/partners/aw.aspx?Task=JoinT2&amp;AffiliateID=9107﻿,2014-11-05T21:25:27,Mehmet Demirel,,
,,,check men out i put allot of effort into my music but unfortunatly not many  watch it﻿,2014-11-05T21:56:39,PacKmaN,,
,,,pls http://www10.vakinha.com.br/VaquinhaE.aspx?e=313327 help me get vip gun  cross fire al﻿,2014-11-05T22:21:36,Alessandro leite,,
,,,Add me here...https://www.facebook.com/TLouXmusic﻿,2014-11-05T22:41:42,TLouX music,,
,,,CHECK MY CHANNEL OUT PLEASE. I DO SINGING COVERS﻿,2014-11-05T22:50:02,Tyrek Sings,,
,,,I think this is now a place to promote channels in the comment section lol.﻿,2014-11-06T01:12:14,NursePoison,,
,,,Get free gift cards and pay pal money!﻿,2014-11-06T01:44:12,Peter Johnson,,
,,,Check out pivot animations in my channel﻿,2014-11-06T02:22:00,MiningBip3,,
,,,Follow me on twitter &amp; IG : __killuminati94﻿,2014-11-06T02:39:07,Ju`Wan Wright,,
,,,Check me out I'm all about gaming ﻿,2014-11-06T03:10:26,CronicleFPS,,
,,,Oppa! Yeah! Best Song!﻿,2014-11-06T04:42:33,marye,,
,,,More... http://www.sunfrogshirts.com/Sunglass-World.html?24398﻿,2014-11-06T04:54:22,Giang Nguyen,,
,,,https://www.facebook.com/teeLaLaLa﻿,2014-11-06T04:55:41,Giang Nguyen,,
,,,http://www.twitch.tv/zxlightsoutxz﻿,2014-11-06T05:40:43,MasterRobotTV,,
,,,reminds me of this song https://soundcloud.com/popaegis/wrenn-almond-eyes﻿,2014-11-06T09:15:12,ROB YSF,,
,,,What free gift cards? Go here  http://www.swagbucks.com/p/register?rb=13017194﻿,2014-11-06T09:41:07,Rancy Gaming,,
,,,"Search ""Chubbz Dinero - Ready Or Not "" Thanks ﻿",2014-11-06T09:49:14,FatPocketsTv,,
,,,Follow me on Twitter @mscalifornia95﻿,2014-11-06T13:41:30,Holly,,
,,,😫😓😏😪😔😖😌😭😎😚😘😙😗😋😝😜😛😍😒😞😷😶😵😳😲😱😟😰😩😨😧😦😥😤😣😮😴😢😡😠😬😕😑😐😯😉😈😇😆😅😄😃😂😁😀😊☺  every single types of face on earth﻿,2014-11-06T14:50:18,unknown,,
,,,▬▬▬▬▬▬▬▬▬▬ஜ۩۞۩ஜ▬▬▬▬▬▬▬▬ ＤＡＭＮ ＴＨＩＳ ＣＯＭＭＥＮＴ ＩＳ ＦＡＮＣY ▬▬▬▬▬▬▬▬▬▬ஜ۩۞۩ஜ▬▬▬▬▬▬▬▬﻿,2014-11-06T15:28:54,"thevlogmasters Vlog, Challenges en nog veel meer!",,
,,,CHECK MY CHANNEL FOR MY NEW SONG 'STATIC'!! YOU'LL LOVE IT!!﻿,2014-11-06T15:31:35,Freddie Barton,,
,,,Incmedia.org where the truth meets you.﻿,2014-11-06T16:48:02,Sean Ortiz,,
,,,look at my channel i make minecraft pe lets play ﻿,2014-11-06T17:50:59,ZodexHD,,
,,,I found out this song now﻿,2014-11-06T17:59:30,Andr3wco7,,
,,,2 BILLION!!!﻿,2014-11-06T18:00:04,michelle clough,,
,,,Song name??﻿,2014-11-06T18:07:21,lebanonwarior1,,
,,,please like : http://www.bubblews.com/news/9277547-peace-and-brotherhood﻿,2014-11-06T18:11:37,amine moha,,
,,,hey again if you guys wouldnt mind chacking out my rap give it like and il  giver 3 of your vids a like﻿,2014-11-06T18:23:21,PacKmaN,,
,,,http://www.amazon.co.uk/gp/offer-listing/B00ECVF93G/sr=8-2/qid=1415297812/ref=olp_tab_refurbished?ie=UTF8&amp;condition=refurbished&amp;qid=1415297812&amp;sr=8-2 ﻿,2014-11-06T18:24:19,fad lad,,
,,,"The most watched video on YouTube is Psy’s “Gangnam Style”, with 2.1  billion views. PSY - GANGNAM STYLE (강남스타일) M/V﻿",2014-11-06T18:55:14,Digital Media Butterfly,,
,,,Subscribe to me and I'll subscribe back!!!﻿,2014-11-06T19:00:11,JackTheLad,,
,,,http://flipagram.com/f/LUkA1QMrhF﻿,2014-11-06T19:28:25,JoelR Ch,,
,,,For Christmas Song visit my channel! ;)﻿,2014-11-06T19:40:59,OverSpace33,,
,,,http://www.gofundme.com/gvr7xg﻿,2014-11-06T20:55:09,Detroit Red Wings,,
,,,Subscribe to me i subscribe back!!!! Plus i have a nice ass lol﻿,2014-11-06T22:00:58,DirtySouthFlorida3,,
,,,https://www.change.org/p/facebook-twitter-youtube-do-not-censor-julien-blanc ﻿,2014-11-06T22:40:49,David Boček,,
,,,https://soundcloud.com/jackal-and-james/wrap-up-the-night﻿,2014-11-06T22:53:08,Jackal James,,
,,,https://www.surveymonkey.com/s/CVHMKLT﻿,2014-11-06T23:16:52,Goran Theboss,,
,,,Please give us a chance and check out the new music video on our channel!  You won't be disappointed.﻿,2014-11-06T23:22:32,YoungBrothersRecords,,
,,,Please subscribe to me﻿,2014-11-07T01:22:02,Chinsoman Films,,
,,,"This is the best, funny and viral video of history (youtube) THE TRUE﻿",2014-11-07T01:24:27,Moymoy Palaboy,,
,,,Please check out my vidios﻿,2014-11-07T01:50:10,Mason Sieverding,,
,,,OPPA GANGNAM STYLE!!!﻿,2014-11-07T02:02:02,VIP 2NEXO,,
,,,"The funny thing is, 1,700,000,000 of the views are spam bots. I mean c'mon  2 BILLION views? BS!﻿",2014-11-07T04:13:47,Gaming 101,,
,,,OPPA &lt;3﻿,2014-11-07T04:39:08,Chack Jason,,
,,,It's so funny it's awesomeness lol aaaaaaa sexy lada😂﻿,2014-11-07T04:48:01,Kitts Hausman,,
,,,most viewed video in the world﻿,2014-11-07T05:04:28,TheInfectedDoge Gameplay,,
,,,I'm here to check the views.. holy shit﻿,2014-11-07T07:46:57,Warrdrew,,
,,,"Dear person reading this, You are beautiful and loving Have a great day﻿",2014-11-07T07:54:13,Parssa Alimadad,,
,,,http://www.ermail.pl/dolacz/V3VeYGIN CLICK  http://www.ermail.pl/dolacz/V3VeYGIN  http://www.ermail.pl/dolacz/V3VeYGIN  http://www.ermail.pl/dolacz/V3VeYGIN  http://www.ermail.pl/dolacz/V3VeYGIN  http://www.ermail.pl/dolacz/V3VeYGIN  http://www.ermail.pl/dolacz/V3VeYGIN﻿,2014-11-07T08:19:37,Adrian Skalak,,
,,,Have you tried a new social network TSU? This new social network has a  special thing.You can share the posts as well as on fb and twitter and even  to'll get paid You can registr here:  https://www.tsu.co/WORLDWIDE_LIFE﻿,2014-11-07T09:04:08,BeatBoxBaaa,,
,,,The Guy in the yellow suit kinda looks like Jae-suk ﻿,2014-11-07T09:55:39,Cool Ong,,
,,,"People, here is a new network like FB...you register also free, the  difference is only that you get paid for sharing, commenting and liking  posts and so one...don't waste your time on fb for sharing and not being  paid!! Register here to make also money with your everyday posts!!  https://www.tsu.co/slema13 Wellcome to everyone! ;)﻿",2014-11-07T12:08:13,Uroš Slemenjak,,
,,,How are there 2 billion views and theres only 2 million people in the  world!?!?!?!! MULTIPLE ACCOUNTS!!!1111﻿,2014-11-07T12:16:08,Adam Mudd,,
,,,WAT DA FUCK THIS THE MOST VIEWED VIDEO IN YOUTUBE!﻿,2014-11-07T12:51:06,Cromwell John Pascual,,
,,,OMG 2/7 People watched this video because there are 7 billion people in the  world and 2 billion watched this﻿,2014-11-07T12:58:57,Starfire003,,
,,,What is he saying?!?!?!?!?!?!?!?$? ﻿,2014-11-07T13:12:45,Lindsay Wofford,,
,,,this has so many views﻿,2014-11-07T13:33:12,Romeo Sweeney,,
,,,OMG over 2 billion views!﻿,2014-11-07T13:48:31,Thanh Phong,,
,,,Subscribe to me plz plz plz plz plz plZ ﻿,2014-11-07T13:49:41,Callum Barr,,
,,,http://www.twitch.tv/tareko100 Follow him on twitch and enter the keyword  !5800 and you'll have a chance of winning a really nice and expensive gun  for csgo that you can sell on the steam market﻿,2014-11-07T14:11:41,funtimekid1199,,
,,,"i am 2,126,492,636 viewer :D﻿",2014-11-07T14:25:48,css403,,
,,,https://www.tsu.co/Aseris get money here !﻿,2014-11-07T14:29:19,Dovydas Baranauskas,,
,,,Fantastic!﻿,2014-11-07T15:14:48,전광용,,
,,,The population of world is more than 7 billion﻿,2014-11-07T15:31:25,sagar basnet,,
,,,2.126.521.750  views!!!!!!!!!!!!!!!!!﻿,2014-11-07T15:43:29,Vitor Belliny,,
,,,Wow 23 min ago﻿,2014-11-07T15:58:09,Gianpaolo T,,
,,,SUPER!!! !!!!!!!!!!!!!!!!!!!!!!!!!!!!!!!!!!!!!!!!﻿,2014-11-07T15:58:57,josson 64,,
,,,P E A C E  &amp;  L O V E  ! !﻿,2014-11-07T16:38:47,Isuzu,,
,,,How can this music video get 2 billion views while im the only one watching  here on earth?????? lol﻿,2014-11-07T17:03:01,jayson calzado,,
,,,Please friend read my book and repass: http://www.4shared.com/web/preview/pdf/CjFofTxeba?﻿,2014-11-07T17:06:48,O sábio das 7 eras,,
,,,subscribe to me :) ﻿,2014-11-07T17:53:51,Pro Video,,
,,,Still the best. :D﻿,2014-11-07T17:54:36,Vepi road to TIx,,
,,,The most liked video on YouTube...﻿,2014-11-07T18:05:40,Bert Dionne,,
,,,Still watching this 2 years later? ﻿,2014-11-07T18:11:06,no honesty,,
,,,"Hello! I'm kind of new to Youtube, And soon i'm soon going to be making  Launchpad Video's! :D I would really appreciate if i got some subs before i  started so that people can spot me easily! I dont really care about hate  comments so dont bother -_-﻿",2014-11-07T18:11:56,LaunchPad Mad,,
,,,"Lol...I dunno how this joke gets a lot of likes, but whatever. xD﻿",2014-11-07T18:52:29,Aj Riberal,,
,,,2 Billion Views For This Piece Of Shit... ~ A R E ~ Y O U ~ K I D D I N G ~ M E ~﻿,2014-11-07T19:18:25,SRK FAN,,
,,,GANGMAN STY- *D-D-D-D-D-D--DROP THE BASS!!*﻿,2014-11-07T19:27:45,Ben Stalker,,
,,,Will this song ever reach 7 Billion Views?﻿,2014-11-07T19:33:03,xxxTheMikeTxxx,,
,,,"Im a RAPPER/SONGWRITER, check my video PLEASE..also subscribe for more  thanks :) tell me what you think.﻿",2014-11-07T19:33:46,Kemal Kurtoglu,,
,,,"Hello all 29.24% earth population of the world, hope your having a great  day :)﻿",2014-11-07T19:45:26,ahmed khalifa,,
,,,"Is this the video that started the whole ""got my dick stuck in an elevator""  excuse thing? ﻿",2014-11-07T19:47:06,Adele Lupei,,
,,,Can anyone sub to my channel? :D﻿,2014-11-07T19:47:16,Daniel Istrati,,
,,,prehistoric song..has been﻿,2014-11-07T20:01:15,Stronzo Chicheritr,,
,,,You think you're smart?        Headbutt your face.﻿,2014-11-07T20:05:35,none dies virgin life fucks us all,,
,,,DISLIKE.. Now one knows REAL music - ex. Enimen ﻿,2014-11-07T20:12:11,JakeFrostMiner Palanca,,
,,,Loool nice song funny how no one understands (me) and we love it﻿,2014-11-07T20:16:51,Tee Tee,,
,,,Like if you came here too see how many views this song has.﻿,2014-11-07T20:18:19,Oopsthenameistoolong Oh well,,
,,,We pray for you Little Psy ♡﻿,2014-11-07T20:45:32,witsnow roxiie,,
,,,"''Little Psy, only 5 months left.. Tumor in the head :( WE WILL MISS U &lt;3﻿",2014-11-07T21:06:36,johan gade,,
,,,Follow me on Instagram. _chris_cz  ﻿,2014-11-07T21:39:21,2666playboy,,
,,,how is this shit still relevant ﻿,2014-11-07T22:01:04,Melissa Harmon,,
,,,LOL this shit never gets old﻿,2014-11-07T22:19:03,Eddie Murphy,,
,,,What Can i say....This Song He Just Change The World Completely... So good job PSY... (and your girls are awesome :))) )﻿,2014-11-07T22:21:29,Alucard Hellsing,,
,,,On 0:02 u can see the camera man on his glasses....﻿,2014-11-07T22:22:29,John Plaatt,,
,,,this comment is wrong﻿,2014-11-07T22:41:04,YOU ARE NOW WASTING SECONDS OF YOUR LIFE BY READING THIS LONG STUPID NAME WHICH MAKES NO SENSE!,,
,,,i hate this music. fucking singer and every koean chainise ana US sucks me dick.﻿,2014-11-07T22:59:13,juanmanuel cespedes,,
,,,2:05. Hahahahah ﻿,2014-11-07T22:59:37,Kirill Nazarethian,,
,,,Can we reach 3 billion views by December 2014? ﻿,2014-11-07T23:19:08,King uzzy,,
,,,"Dumb Guy: Why is there 2 billion views when there are 7 million people on  earth??? Also, I know what 1+1 equals! 1+1=1! I am a smartie pants﻿",2014-11-07T23:23:54,Gio D.,,
,,,"People Who Say That ""This Song Is Too Old Now, There's No Point Of  Listening To It"" Suck. Just Stfu And Enjoy The Music. So, Your Mom Is Old  Too But You Still Listen To Her Right?....﻿",2014-11-07T23:26:04,anthony Jennings,,
,,,The Funny Thing Is That this song was made in 2009 but it took 2 years to  get to america.﻿,2014-11-08T00:26:35,TheLegitBroz,,
,,,why I dont see any comments but mine?:/﻿,2014-11-08T00:36:31,mindaugux,,
,,,this jap is such a piece of shit. he is such a worthless fish head. i dont  know how any one likes this dumb untanlted gook. this isnt even fucken  music. this is so fucking sad that this is even such thing. people are so  fucked up.﻿,2014-11-08T00:45:40,Bert Ernie,,
,,,I remember when everyone was obsessed with Gangnam Style 😗﻿,2014-11-08T01:28:58,Tabby Ghani,,
,,,Remove This video its wank﻿,2014-11-08T02:18:42,UKz DoleSnacher,,
,,,"It's so hard, sad :( iThat little child Actor HWANG MINOO dancing very  active child is suffering from brain tumor, only 6 month left for him .Hard  to believe .. Keep praying everyone for our future superstar.  #StrongLittlePsY #Fighting  SHARE EVERYONE PRAYING FOR HIM http://ygunited.com/2014/11/08/little-psy-from-the-has-brain-tumor-6-months-left-to-live/ ﻿",2014-11-08T02:24:02,JD COKE,,
,,,"Why the fuck this keeps updated? Comments :""5 minutes ago"" Song: ""2 years and  4 months ago""﻿",2014-11-08T02:29:17,Joaco Remis,,
,,,MANY MEMORIES...........﻿,2014-11-08T02:45:12,TheRogueScorpion,,
