Date,Time,URL,Content,Date_2,Author,Tweet_Text,Spam_Ham
,,,I LOVE YOU KATTY PERRY &lt;3 ﻿,2014-10-20T17:56:04,ikbal kemerkaya,,ham
,,,"HONESTLY, I WANNA SEE YOU BE BRAVE! oh wait...﻿",2014-10-20T18:33:44,Flip Tee,,ham
,,,;-)﻿,2014-10-20T20:35:13,hernan perez ovando,,ham
,,,this video is great .....!!! I love this........and like much katy perry﻿,2014-10-21T04:52:03,Merenguette,,ham
,,,"Good thing she brought her spray-on tan, hairstylist, makeup artist, and  cameraman.﻿",2014-10-21T13:50:47,Freya Questionmark,,ham
,,,"666,002,018 views! 666 million. 666! Katy Perry illuminati confirmed!!!﻿",2014-10-21T15:07:11,subscrool,,ham
,,,"I make guitar covers, please have a look at my channel﻿",2014-10-21T15:20:49,Youyou A.,,spam
,,,It should be illegal to be this goodlooking as this babe is...﻿,2014-10-21T15:30:56,MrSlowGhost,,ham
,,,katy is mine the girl of my dreams ♥﻿,2014-10-21T18:16:46,sebastian hudson,,ham
,,,I love this song﻿,2014-10-21T20:53:49,Chewwy Moriarty,,ham
,,,She is fit﻿,2014-10-21T21:09:29,haribo elf,,ham
,,,I love the song roar it make me think am fill the way﻿,2014-10-23T05:24:14,Patricia  Reyes,,ham
,,,"How do you forget you have a choice, and what the fuck, surviving a plane  crash has a 1/1000 chance of happening.﻿",2014-10-23T22:20:43,ollie123216,,ham
,,,"she is a fool. this is a foolish video. the lyrics are all about her and  how great she is. she is arrogant, obviously. but the thing is that there  are a lot of idiots.. look how many hits this garnered. the young stupid  girls who listen to her are numbering in the millions i guess. this video  is a piece of trash. why would anyone ever like it or listen to it? because  these stupid little girls have idiots for fathers and mothers.. and so they  are going to turn into idiots also.. just like this stupid singer. ﻿",2014-10-24T01:21:49,nleeklee polowtehow,,ham
,,,":: ATTENTION : WE NEED 10 Million Views More for FIREWORK to Reach 500M .. We have only 1 and half day left for katy's birtgday. Listen How it could be possible?? &gt;&gt;JUST Open different Tabs from Different Browser &gt;&gt;Dont Watch Full Video, Remember We dont have time on hand, Its Time Wasting. View it only for 30 sec. Plz thumbs up and share﻿",2014-10-24T06:05:07,KatyPerry TheQueenOfPop,,spam
,,,(( rapid facebook )) the free version of all colors and is characterized by  fast and beauty download now https://play.google.com/store/apps/details?id=com.rapid.facebook.magicdroid﻿,2014-10-24T09:55:30,احمد الهوارى,,spam
,,,Hey Katycats! We are releasing a movie at midnight UK time to celebrate  katy's 30th birthday! Be sure to subscribe to our channel and watch the  movie!﻿,2014-10-24T14:12:49,katy perry,,spam
,,,"I just realized that this verses in this song have the exact same melody as  the verses in ""Hey Ho"" by the Lumineers.﻿",2014-10-24T17:11:17,randman21,,ham
,,,:-D ♪♪♪ This is my favorite song ♥﻿,2014-10-24T17:41:52,ΑΓΛΑΪΑ ΛΕΠΤΟΚΑΡΙΔΟΥ,,ham
,,,this song never get's old &lt;3 ﻿,2014-10-25T01:53:36,Brian Schultes,,ham
,,,HAPPY BIRTHDAY KATY :) http://giphy.com/gifs/birthday-flowers-happy-gw3JY2uqiaXKaQXS/fullscreen  (That´s not me)﻿,2014-10-25T08:13:25,Hude Deni,,spam
,,,"Hey ! I know most people don't like these kind of comments &amp; see at spam,  but I see as free advertising . So please check out my cover of Sparks Fly  by Taylor Swift ! It is not the best ever I know, but maybe with some  encouraging words of wisdom from many of you I can become better! Please go  to my channel and check it out !﻿",2014-10-25T15:23:36,Ashley Smith,,spam
,,,Www.youniqueproducts.com/joannagordon Younique by Joanna Gordon www.youniqueproducts.com﻿,2014-10-25T15:55:59,Charles Breheny,,spam
,,,I like you . Katy Perry 600▲60▲6▲﻿,2014-10-25T16:59:02,ali aydın,,ham
,,,Glad to know im not the only one who knows its katheryn's birthday today :)  happy birthday katy...and my sister. (they seriously have the same  birthday...)﻿,2014-10-25T20:10:35,IMustKillGoogle+,,ham
,,,Katy Perry can't sing for shit. All i hear it autotune.﻿,2014-10-26T08:33:48,GX2re,,ham
,,,I fucking hate her. Why? Because she don't write her songs she got  producers for that. Second why tha fack is she in every song almost nude  mayby because she's an attention hooker.﻿,2014-10-26T08:38:36,Denzel Saimi,,ham
,,,Also LuckyMusiqLive she probably could help u make it big because I think u  have talent. Just look her name up on the internet. Hit me up when u get  this message﻿,2014-10-26T20:10:46,Shaun Mac,,spam
,,,Check out my drum cover of E.T. here! thanks -&gt;   /watch?v=NO9pOVZ9OIQ&amp;list=UUltuCDIHsDeI01by1OW7WuQ﻿,2014-10-27T13:19:06,Nick McGoldrick,,spam
,,,Put famous people in the jungle for an hour and look what happens.﻿,2014-10-27T21:59:07,Emily Thrun,,ham
,,,"She kinda let herself go, huh?﻿",2014-10-27T22:31:50,Robert Petrea,,ham
,,,we all love you Katy Perry &lt;3﻿,2014-10-28T16:12:32,ahmed soliman,,ham
,,,Sign up for free on TSU and start making money on social media add/follow  me and ill add follow you!! http://tsu.co/Roberts9010﻿,2014-10-28T17:22:33,Yonate,,spam
,,,Love it when I can relate to my daughter's music. :-) Katy Perry - Roar  (Official): http://youtu.be/CevxZvSJLk8﻿,2014-10-28T18:10:39,Marie farias,,ham
,,,Subscribe me and i subscribe you back!!﻿,2014-10-28T20:04:45,NeverGreen35,,spam
,,,Katy Perry - Roar (Official)  #soundsofsunday   #music  ﻿,2014-10-29T01:23:19,Chris Madzier,,ham
,,,"When I hear Katy singing this, I cry. The song has got depth.﻿",2014-10-29T09:46:20,adrianavargova,,ham
,,,Love it﻿,2014-10-29T09:53:12,Boshra Abdrhman,,ham
,,,People who believe in Illuminati are stupid the same people believe that  911 was made by the American government﻿,2014-10-29T11:28:58,youngj,,ham
,,,plz subscribe to my channel i need subs and if you do i will sub back i  need help﻿,2014-10-29T19:39:38,themind blasters,,spam
,,,please look up DHG SONGS this is my playlist with a bunch of amazing songs ﻿,2014-10-29T21:34:30,D Germain,,spam
,,,Hey! I'm NERDY PEACH and I'm a new youtuber and it would mean THE ABSOLUTE  world to me if you could check 'em out! &lt;3  Hope you like them! =D﻿,2014-10-29T22:44:41,Nerdy Peach,,spam
,,,00 : 39 Im pretty sure that tiger just wanted a hug﻿,2014-10-30T05:20:18,michael smith,,ham
,,,http://vimeo.com/106865403﻿,2014-10-30T16:19:21,Alain Marius,,spam
,,,this song gives me strength! love her lyrics. this video really brings the  lyrics to life. I'm getting known fast because i rap with meaning.. thumbs  up if you piss next to the water in the toilet so its quiet...﻿,2014-10-30T17:58:18,LuckyMusiqLive,,spam
,,,http://minhateca.com.br/mauro-sp2013/Filmes+Series+Desenhos+Animes+Mp3+etc﻿,2014-10-30T20:43:47,Mauro Tricolor,,spam
,,,https://www.facebook.com/antrobofficial﻿,2014-10-31T01:02:53,Grace R,,spam
,,,i love you katy perry because you will sing nice than shakira﻿,2014-10-31T07:37:32,sreekrishna praveen,,ham
,,,http://hackfbaccountlive.com/?ref=4344749﻿,2014-10-31T20:39:28,EDIN TIUL,,spam
,,,Facebook account HACK!! http://hackfbaccountlive.com/?ref=4477063﻿,2014-11-01T02:37:29,Nedim Alp SEÇGEL,,spam
,,,I love katty perry﻿,2014-11-01T17:28:29,Jackson Heber,,ham
,,,The Perry you're doing a good job good job I love all of their videos and  by the way can you please describe to my channel please please please  please I'm trying to get as many comments to Skyburst lights is a cancer  and get famous please﻿,2014-11-02T02:37:16,Khris Parkhill,,spam
,,,I did a cover if u want to check it out THANK U.....Michael Age 8﻿,2014-11-02T13:37:06,Michael Jurek,,spam
,,,EVERYBODY PLEASE VOTE KATY AT EMA 2014 !!!!!  Best song  Best female Best pop Best live Best look  Best video  PLEASE VOTE KATY !!!!! PLEASE PLEASE PLEASE !!!!! VOTE VOTE VOTE !!!!! KATY KATY KATY !!!!!﻿,2014-11-02T14:15:55,Bruno Alderete,,spam
,,,Οh my god ... Roar is the most liked video at Vevo .. while 2 months ago  was Justin's Baby.. congrats Katy . Applause &lt;3 ﻿,2014-11-03T14:08:14,John Monster,,ham
,,,https://soundcloud.com/j-supt-fils-du-son/fucking-hostile﻿,2014-11-04T03:52:25,kyle kops,,spam
,,,https://www.facebook.com/myfunnyriddles﻿,2014-11-04T13:13:28,Truc Ng,,spam
,,,Hi everyone! Do you like music? Then why not check out my music channel.  The LEXIS band will be uploading their own songs and covers soon so don't  miss out. Please SUBSCRIBE too as it does help us out a lot. Just takes one  click. -&gt;﻿,2014-11-04T20:24:58,OFFICIAL LEXIS,,spam
,,,https://www.facebook.com/photo.php?fbid=313454548839369&amp;set=a.207230212795137.1073741825.100005244783212&amp;type=1&amp;theater  1111111111111111111﻿,2014-11-05T11:36:42,hassan ss,,spam
,,,I'd rather hear some propa explicit gangsta rap insted of this garbage.  This song is trash !﻿,2014-11-05T17:37:25,ELPaso1990TX,,ham
,,,"DAMNNNNNNNN, she is sexy O_O﻿",2014-11-05T18:30:45,m450nH,,ham
,,,Such a good song ans Katy sounds great over the melody. Im growing as an  artist everyday from my hit song 'CRAZY' which has got my name out there.  cant thank my fans more for their support. If you could take a moment? to  check it and my music? maybe you'll join me to make my dream come true :)  thank you for your time﻿,2014-11-05T22:50:58,RezAIIDay,,spam
,,,I LOVE YOU!!! Because u make me smile when im sad you cheer me up with your  beautiful songs (: &lt;3﻿,2014-11-06T00:55:49,a carlton,,ham
,,,"This song is the most boring, asinine song I have ever heard. Coming from a  guy who liked ""Teenage Dream"" (the song). Ever since Katy Perry's divorce  it's wave after wave of shitty but successful songs... For those of you  saying ""This is the next wave of pop music"". Stick it up your ass. Katy  Perry is like Silly Putty. ﻿",2014-11-06T02:47:23,William Carey,,ham
,,,Katy Perry - Roar (Official): http://youtu.be/CevxZvSJLk8. I love this song  and video Katy Perry Rocks Wahoo! 😀😘﻿,2014-11-06T05:26:28,Googles top ten pics,,ham
,,,And somehow she has access to makeup in the middle of the woods...﻿,2014-11-06T12:56:46,Abhishek Kumar Gendah,,ham
,,,It looks so real and my daughter is a big fan and she likes a lot of your  songs.﻿,2014-11-06T13:44:00,Fazeela Boodoo,,ham
,,,"I can't comprehend why this video has nearly 700,000,000 views. Some people  found 'Gangnam Style' funny so that explains its high view count but this  is just an awful pop song. I really have no clue on this one.﻿",2014-11-06T15:58:58,LrsLzk,,ham
,,,"Lets be honest, you wouldn't last 1 day on your own in the jungle. Stop  living n a fairy world.﻿",2014-11-06T16:30:30,Bobby Carlos,,ham
,,,me segue ha  https://www.facebook.com/marcos.sousa4?fref=ts﻿,2014-11-06T19:50:16,Quinho Divulgaçoes,,spam
,,,"Nature is beautiful, no need to place tits in video to impress people.﻿",2014-11-06T20:04:45,Serj Cat,,ham
,,,This is so stupid. If you Roared at a Lion in real life you'd dede﻿,2014-11-06T22:17:27,Yourmomma Son,,ham
,,,This song is so AWESOME!!!She made everything stand out and all the viewers  could imagine themselves at the setting of the video. Awesome Job Katy  Perry!!!!﻿,2014-11-07T01:17:29,Paola Zelaya Deras,,ham
,,,Katy Perry - Roar (Official): http://youtu.be/CevxZvSJLk8﻿,2014-11-07T09:19:50,dinda zivic,,ham
,,,Katy Perry is lion﻿,2014-11-07T11:25:13,BIANCA FLORENTINA MANTA,,ham
,,,"People, here is a new network like FB...you register also free, the  difference is only that you get paid for sharing, commenting and liking  posts and so one...don't waste your time on fb for sharing and not being  paid!! Register here to make also money with your everyday posts!!  https://www.tsu.co/slema13 Wellcome to everyone! ;)﻿",2014-11-07T12:16:21,Uroš Slemenjak,,spam
,,,"I've figured out why I dislike this song: it's supposed to be a power  ballad right? Something that's uplifting and motivating by the end.  However, the final chorus has NO extra UMPH at the end and actually sounds  just like the first one. Instead of crescendo-ing into a powerful finish,  ""Roar"" just says on the same wavelength. It falls flat.﻿",2014-11-07T13:17:57,xsilvermistx,,ham
,,,i like this song the video goes perfect with it﻿,2014-11-07T13:37:51,The Robot Green Hypno,,ham
,,,"""....because I AM a champion...and you're gonna hear me roar!""   Today I AM my own champion  Today I AM a champion for the Creator  Today I AM doing positive in my world Today I AM blessing and healing all around me Today I AM successful and  creating success  ﻿",2014-11-07T15:05:25,Paul Lewis,,ham
,,,"#nowplaying ""Weekendmix"" track 04 : Katy Perry - Roar (DJ Denis Shmelev &amp; DJ Alex Serov Remix) http://youtu.be/CevxZvSJLk8   Listen live at: www.smartfm.nl/livestream.html﻿",2014-11-07T18:08:44,Anders Lundgren,,spam
,,,Katy Perry's songs are the best of the songs of women artists.﻿,2014-11-07T19:33:46,Martwy Karas,,ham
,,,i like this song because of all the animals and i like this song .﻿,2014-11-07T21:02:30,Caitlin Hepton,,ham
,,,http://www.wattpad.com/story/26032883-she-can-love-you-good﻿,2014-11-07T23:21:19,Sam Kesha,,spam
,,,I love this song so much!:-D I've heard it so much I pretty much memorized  the lyrics﻿,2014-11-08T02:16:29,Kathy Akers,,ham
,,,"Hey Guys, I know you tend to skip these comments, but Take a look first.  I am Free Fire, A Big Room, Progressive House, Deep House, Dubstep &amp;  Chillstep Producer from a small town in Missouri. Down here, I have no  support from the community, and all I really ask is some critiquing,  Support, and Views.   My Music has gotten much better then what it was 10 months ago, and I  promise my new content should be more then satisfying. Soon I should be  able to advertise and I wont pester you guys anymore.  So gimme a chance and check out my music, thanks and god bless.﻿",2014-11-08T05:02:26,Free Fire,,spam
,,,For latest movies 2014 please visit this site  http://www.networkedblogs.com/p/11cPWb?ref=panorama﻿,2014-11-08T14:17:38,Jacky Chan,,spam
,,,I love that you subscribed﻿,2014-11-08T17:22:54,Rafael Macho Gonzalez Jr,,spam
,,,https://www.tsu.co/ToMeks Go register ;) free money;)﻿,2014-11-08T20:37:45,Oreja Ramanauskaite,,spam
,,,"great song, but we all know that Katy buys her views..﻿",2014-11-09T12:31:35,We are proud to be Smilers,,ham
,,,check out mah girl it duh shit yo﻿,2014-11-09T12:50:06,MntDewWigger,,spam
,,,Check out this video on YouTube:Facebook lhudygirlamaya ﻿,2014-11-09T13:43:04,Marnell Ampungan,,spam
,,,"Hey yall its the real Kevin Hart, shout out to my fans!!! follow me +RealKevinHeart ﻿",2014-11-09T19:35:44,Kwon Kee,,spam
,,,Check out my acoustic channel ﻿,2014-11-10T01:07:06,Nathan Waterhouse,,spam
,,,♫I know someone will see this ♥ I have a dream… I don’t have the greatest videos or the best quality Right now I feel like i'm not getting anywhere and I need your help ♫ If you could possibly watch my videos it means the world to me ♥ Please thumbs this up so others can see… I appreciate it so much ♥♫ Please listen before you hate. Honestly i  appreciate it so much  You don’t have to love me just give this 17 year old a chance﻿,2014-11-10T02:18:19,Arianna,,spam
,,,"https://apps.facebook.com/my-polls/utsitcompetition2014?from=user_link&amp;ref_id=ouxg5e .  Please open this link and vote for  anand niketan international school, the  project name is project Fr-e-dom and share it with  yours friend.﻿",2014-11-10T09:00:34,monal shah,,spam
,,,I hate videos like these with those poor animals.﻿,2014-11-10T15:58:40,MagpiedudeGaming,,ham
,,,Hii youtube﻿,2014-11-10T16:14:20,Cem Devecioğlu devecioğlu,,ham
,,,nice ..very nice﻿,2014-11-10T16:36:17,Karim Bazoka,,ham
,,,I love this song!!!﻿,2014-11-10T17:00:11,makayla Yarborough,,ham
,,,*KATY YOU ARE A SHIT GO DIE!!!!!ROAR IS A FLOOOOOOOOOOOOOOOOOOOOP*﻿,2014-11-10T18:11:36,Nice Girl,,ham
,,,I love your music ﻿,2014-11-10T18:18:04,Jamie Breedlove,,ham
,,,My 6th grade teacher looked exactly like Katy Perry come to think of it...﻿,2014-11-10T18:18:08,FudgePlaysMC,,ham
,,,curti? click here ?  https://www.facebook.com/demiilovatofas?ref=hl   https://www.facebook.com/pages/Frases-Secretas/448800865296855?ref=hl﻿,2015-06-04T17:16:09,Taina Boaventura,,spam
,,,http://www.ermail.pl/dolacz/UnNfY2I=                  Please click on the  link﻿,2015-06-04T19:02:10,DIIL GANG,,spam
,,,Come check out our parody of this!﻿,2015-06-04T23:00:48,Lauren And Victoria,,spam
,,,Please subscribe to us and thank you﻿,2015-06-05T03:15:10,Those two boys,,spam
,,,PLEASE VOTE FOR ME FOR THE WET SEAL MODEL 2015 CONTEST! MY INSTAGRAM  USERNAME IS destinyforever_  http://www.wetseal.com/modelsearch15/modelsearch15.html﻿,2015-06-05T03:33:16,Destiny Cable,,spam
,,,"SIMPLY PUT, OUR CUSTOMERS LOVE US... and so will you!https://www.facebook.com/greenleader﻿",2015-06-05T10:04:47,Portman P.,,spam
,,,https://binbox.io/DNCkM#qT4Q1JB1﻿,2015-06-05T15:11:28,sunny leone,,spam
,,,"Almost 1 Bil. What? Wow, GS sucks, in my opinion.﻿",2015-06-05T17:59:36,KillerDan,,ham
,,,Katty is the best! ! ! ! ﻿,2015-06-05T18:13:30,Julia Szefer,,ham
,,,That was very good I mean very very much good ﻿,2015-06-05T18:21:28,Bader Awesome,,ham
,,,This song means so much to me thank you  soooooooooooooooooooooooooooooooooooooooo much:-) Xxx﻿,2015-06-05T18:59:52,Kacy Cluley,,ham
,,,&lt;3﻿,2015-06-05T19:02:05,Kasia Fabisiewicz,,ham
,,,"KATY PERRY, I AM THE ""DÉCIO CABELO"", ""DECIO HAIR"". I AM 60 YEARS OF AGE. I  DON""T HAVE FAMILY. I""M SINGLE. ALONE. HOMELESS. I WAS AN ALCOHOLIC: 15 AT  THE AGE OF 46. I AM AN INVISIBLE COMPOSER. MY DREAM IS TO RECORD MY SONGS.  COULD YOU HELP ME? PLEASE! PLEASE! I TRUST THAT THE YOU WILL GIVE ME A  CHANCE. I HAVE 109 VIDEOS IN THE YOUTUBE: deciocabelo canal. KATY PERRY, I  WAS BORN IN OCTOBER 25, TOO. THANK YOU VERY MUCH!!! DECIO HAIR.﻿",2015-06-05T19:29:20,Decio Alves Martins,,spam
,,,Honestly speaking except taylor swift and adele i don't lile any of the  modern day singers. But i must say whenever i hear this song i feel  goosebumps. Its quite inspiring!! Thanks miss Perry!﻿,2015-06-05T19:55:08,Rafi Hossain,,ham
,,,who is going to reach the billion first : katy or taylor ?﻿,2015-06-05T20:01:23,moaz adnan,,ham
,,,"<a href=""http://www.youtube.com/watch?v=KQ6zr6kCPj8&amp;t=2m19s"">2:19</a> best part﻿",2015-05-28T21:39:52.376,Corey Wilson,,ham
,,,wierd but funny﻿,2015-05-28T20:07:20.61,Epic Gaming,,ham
,,,"Hey guys, I&#39;m a human.<br /><br /><br />But I don&#39;t want to be a human, I want to be a sexy fucking giraffe.<br /><br /><br />I already have the money for the surgery to elongate my spinal core, the surgery to change my skin pigment, and everything else! Like this post so others can root me on in my dream!!!!<br /><br /><br />Im fucking with you, I make music, check out my first song! <a rel=""nofollow"" class=""ot-hashtag"" href=""https://plus.google.com/s/%23giraffebruuh"">#giraffebruuh</a>﻿",2015-05-28T19:23:35.355,LaS Music,,spam
,,,Party Rock....lol...who wants to shuffle!!!﻿,2015-05-28T17:49:35.294,Cheryl Fox,,ham
,,,Party rock﻿,2015-05-28T16:28:26.818,PATRICK_TW,,ham
,,,Shuffle﻿,2015-05-28T08:58:10.905,Brian Brai,,ham
,,,Omg﻿,2015-05-28T08:57:27.399,Brian Brai,,ham
,,,This song is just really fun ﻿,2015-05-28T04:15:22.615,Alex DeFeo,,ham
,,,Awsome<br />﻿,2015-05-28T03:52:56.877,Giovanni Jimenez,,ham
,,,wow!!!!!! increible song!!!!!!!!!﻿,2015-05-28T03:26:23.957,Silvia Bascur,,ham
,,,I love this song so much﻿,2015-05-28T03:08:19.077,Michael Whiteside,,ham
,,,2015 LIKEEE﻿,2015-05-28T01:14:19.847,yenis maría Rodríguez,,ham
,,,I miss when people dressed like this.﻿,2015-05-28T00:37:36.183,Alex Martin,,ham
,,,2011- the last year of decent music.﻿,2015-05-28T00:04:06.94,Alex Jansen,,ham
,,,Best song ever!!!!﻿,2015-05-27T23:10:57.437,Aiden Hill,,ham
,,,"super nice, love musique﻿",2015-05-27T22:19:11.429,joe pepin-leblanc,,ham
,,,wowwwwwwwwwwwwwwwwwwwwwwwwwwwwww﻿,2015-05-27T20:47:16.351,bilal kenno,,ham
,,,PARTY ROCK (8) ~﻿,2015-05-27T18:28:25.926,SoulInChains00,,ham
,,,Thumbs up if you watched it in 2011﻿,2015-05-27T17:28:08.014,Phương Linh Nguyễn Ngọc,,ham
,,,this is increidebl﻿,2015-05-27T16:50:10.276,Gonzalo Ferrare,,ham
,,,LMFAO!!!!!!!!﻿,2015-05-27T16:06:08.781,‫אסף שמש‬‎,,ham
,,,just :( superr!!!﻿,2015-05-27T15:44:45.019,Henri Kameron,,ham
,,,2015!! LLIKEE!!﻿,2015-05-27T14:01:10.337,Lukas Ogonowski,,ham
,,,Yeah! Let&#39;s start the party!﻿,2015-05-27T13:37:19.404,LoL Games,,ham
,,,This awesome song needed 4 years to reach to 800 mil views while Tango Switch bitch needed 1 year. its not fairrrrrrr﻿,2015-05-27T13:17:02.665,snsddien,,ham
,,,NICE GIRL :D﻿,2015-05-27T10:49:29.568,ulvi ualiyev,,ham
,,,I remember back when this was so popular everyone on our school was shuffling it was crazy﻿,2015-05-27T10:45:17.666,TransFormersAddict11,,ham
,,,LMFAO!﻿,2015-05-27T10:35:17.73,Brandon Richards,,ham
,,,Super awesome video<br />﻿,2015-05-27T03:47:34.735,Jared Acevedo,,ham
,,,JUST DANCE 3 😂😂😂﻿,2015-05-27T00:34:43.591,Paul Crowder,,ham
,,,"This Will Always Be My Favorite Song<br />But My Favorite Part Is <a href=""http://www.youtube.com/watch?v=KQ6zr6kCPj8&amp;t=3m40s"">3:40</a>-<a href=""http://www.youtube.com/watch?v=KQ6zr6kCPj8&amp;t=4m11s"">4:11</a> In The Video ﻿",2015-05-27T00:33:53.183,Paul Crowder,,ham
,,,Party Rock<br />﻿,2015-05-27T00:25:35.792,keonte moore,,ham
,,,"LMFAO - Party Rock Anthem ft. Lauren Bennett, Goo…: <a href=""https://youtu.be/KQ6zr6kCPj8"">https://youtu.be/KQ6zr6kCPj8</a>     <br />BOX MAN GOT SOME MOVES! :D HE MAKES MEH SMILE﻿",2015-05-26T23:25:22.172,Paige Lebrun,,ham
,,,This the best song i ever hire<br />﻿,2015-05-26T22:40:08.281,EDWARD  PALMA,,ham
,,,"Its funny that Mahogany is there lmao, I actually didn&#39;t know that her brother and uncle are part of LMFAO﻿",2015-05-26T22:21:28.011,breathinsoul,,ham
,,,"Party rock anthem is love,party rock anthem is life﻿",2015-05-26T20:35:37.09,lol Ippocastano,,ham
,,,"Stop,is a very TOP 1﻿",2015-05-26T20:33:36.195,lol Ippocastano,,ham
,,,Ahhh back when my life didn&#39;t suck...﻿,2015-05-26T20:03:52.314,goofygroova16,,ham
,,,Party rock! XD﻿,2015-05-26T20:03:08.241,Boa Hancock Amelia Caria,,ham
,,,CUTE  :)﻿,2015-05-26T19:59:04.606,eliška žáková,,ham
,,,LMFAO best songs ever!﻿,2015-05-26T17:56:36.413,Ciasteczko ;*,,ham
,,,"I fuckin love this song!<br /><br /><br />After, I&#39;m sexy and I know it ﻿",2015-05-26T16:56:19.78,Like👑A👑Boss (Chloe that pony lover),,ham
,,,they Shuffle hard that they made an Earthquake in Nepal﻿,2015-05-26T16:54:58.587,FERTHEBOSS1,,ham
,,,Nice﻿,2015-05-26T16:02:07.1,Madagascar Tropic Voyage,,ham
,,,still.. this reminds me of 1 years back when i was do shuffle everyday﻿,2015-05-26T15:46:26.833,Gulam Maulana,,ham
,,,Love this song makes me wanna dance! ﻿,2015-05-26T14:41:43.931,Tyrone Wilson,,ham
,,,that time in 2011 where this shirt was cool﻿,2015-05-26T13:14:11.83,Ahmed al rawahi,,ham
,,,Love this video and the song of course﻿,2015-05-26T12:53:14.308,Merle Walton,,ham
,,,Check out this video on YouTube:﻿,2015-05-26T12:31:06.611,Jenna Metchooyeah,,spam
,,,Very Nice !!!<br />Yeah Fucking.﻿,2015-05-26T12:29:11.663,Tominke Urbančok,,ham
,,,WELL THIS DUDES FADED THE FUCK OUT!﻿,2015-05-26T12:04:50.454,thebayareapimp,,ham
,,,Ah. Good old times (:﻿,2015-05-26T11:51:10.891,Meneer Mandje,,ham
,,,old and good song﻿,2015-05-26T11:13:20.537,No Name Ass Fuk,,ham
,,,cool﻿,2015-05-26T09:23:16.049,hassan laidli,,ham
,,,not 2 million view anymore :))﻿,2015-05-26T08:19:38.276,wanderer damion,,ham
,,,Good﻿,2015-05-26T07:16:51.245,Jipi Trần,,ham
,,,Check out this video on YouTube:﻿,2015-05-26T06:19:34.669,Xan Harmer,,spam
,,,Check out this video on YouTube:<br />﻿,2015-05-26T04:15:04.528,Jessica Benavides,,spam
,,,Remeber the good ol&#39; days when songs weren&#39;t about butts.  ﻿,2015-05-26T02:03:46.816,ShockMinerX,,ham
,,,You are the music hero😍😎﻿,2015-05-25T22:01:29.58,marie smith,,ham
,,,i was born in the wrong generation﻿,2015-05-25T20:36:42.681,Mattkrewe,,ham
,,,Love this song makes me wanna dance! ﻿,2015-05-25T18:11:22.048,janet rangel,,ham
,,,Love this song makes me wanna dance! ﻿,2015-05-25T18:03:46.138,janet rangel,,ham
,,,Very good! Like! :D﻿,2015-05-25T17:09:31.831,Роза Герман,,ham
,,,"the views...... They&#39;re over 90,000!!!!!!!!!!!!!!!!!!!!!!!!!!!!!!!!!!!!!!!!!!!!!!!!!!!!!!!!!!!!!!!!!!!!!!!!!!!!!!!!!!!!!!!!!﻿",2015-05-25T16:33:18.843,Andy FunnyVideos,,ham
,,,love lmfao party rockin keep it going﻿,2015-05-25T16:30:30.753,Gaven Purdin,,ham
,,,Best Music Ever!!!﻿,2015-05-25T12:24:17.075,Martin Dushkov,,ham
,,,Likeeee﻿,2015-05-25T07:44:47.054,Ernad Smailovic,,ham
,,,Cool﻿,2015-05-25T07:14:26.531,nienke de kimpe,,ham
,,,Remeber when this song was good﻿,2015-05-25T05:43:54.048,D Maw,,ham
,,,2015 &lt;3﻿,2015-05-25T05:37:32.023,jesus sanchez,,ham
,,,i want to be that robot guy...﻿,2015-05-25T03:11:56.18,Chibi Chan,,ham
,,,I LOVE YOUR SONGS﻿,2015-05-25T03:02:02.615,Brianna Reed,,ham
,,,Omg it&#39;s going to have 1bi views!﻿,2015-05-25T02:12:17.753,Lemon Slices,,ham
,,,Dance :)﻿,2015-05-24T23:52:38.563,Georges EIrani,,ham
,,,Check out this video on YouTube:﻿,2015-05-24T17:13:37.7,Paul Garza,,spam
,,,5 years... ﻿,2015-05-24T16:10:47.02,ignacio diaz palma,,ham
,,,cool cool cool cool cool cool cool﻿,2015-05-24T15:54:08.016,Amanda Ludwick,,ham
,,,Wow I love it ﻿,2015-05-24T15:47:50.071,Eliana Guzman,,ham
,,,Who knows the name of that girl?.. and that one.. and that one...﻿,2015-05-24T11:54:19.17,Kenster,,ham
