Date,Time,URL,Content,Date_2,Author,Tweet_Text,Spam_Ham
3/2/2021 0:00,6:48:15,https://twitter.com/AlArabiya/status/1366641482610970626,,,,سي إن إن تستعد إدارة الرئيس بايدن لفرض عقوبات على روسيا على خلفية تسميم المعارض لكرملين أليكسينافالني وسجنه العربية,
12/22/2020 0:00,19:50:00,https://twitter.com/skynewsarabia/status/1363939114605813761,,,,حكم يتصدى لكرة في طريقها لمرمى في لقطة كوميدية نادرة منصات,
2/25/2021 0:00,16:21:48,https://twitter.com/AlArabiya/status/1364973883187675137,,,,تابعونا على العربية عبر برنامج بانوراما ال بتوقيت السعودية ال رئيس وزراء أرمينيا يتهم الجيش بمحاولة الانقلاب لماذا تحول الأطفال من ناقلين لعدوى لمصابين بأعراض شديدة,
2/13/2021 0:00,23:59:16,https://twitter.com/AlArabiya/status/1360740354421645315,,,,خبير بفريق التحقيق في منظمة الصحة العالمية بكين رفضت تزويدنا بيانات حول حالة أصيبت ب كورونا في بداية ظهور الوباء العربية,
3/1/2021 0:00,12:42:15,https://twitter.com/AlArabiya/status/1366368182752186368,,,,بالوثائق تعرف على أهم الاتفاقيات التاريخية لترسيم الحدود بين السودان وإثيوبيا العربية,
2/27/2021 0:00,12:24:02,https://twitter.com/AlArabiya/status/1365638822139150337,,,,الإمارات تعلن وقوفها التام مع السعودية في جهودها الرامية لاستقرار وأمن المنطقة وترفض أي محاولات لاستغلال قضية خاشقجي لتدخل في شؤون المنطقة العربية,
12/23/2020 0:00,12:40:00,https://twitter.com/skynewsarabia/status/1364193289008779265,,,,شحنة جديدة من لقاح كورونا الصيني تصل مطار القاهرة,
13:32:22,12/8/2020 0:00,,,,,الان متاح لدينا شهاده ايلتس معتمده بدون اختبارات وبأقل سعر لتواصل عبر رسائل الصفحه الابتعاث الخارجي الابتعاث الخارجي خريجين جامعة الملك سلمان جامعة الملك عبدالعزيز الابتعاث السعوديه الان الامارات,
12/9/2020 0:00,10:33:43,https://twitter.com/emaratalyoum/status/1359088081278754817,,,,حبس موظف تحرش بطفل في الألعاب المائية الإماراتاليوم,
12/22/2020 0:00,10:47:42,https://twitter.com/skynewsarabia/status/1363802642787532802,,,,امتلاك هاتف محمول بين عقلية الماضي والحاضر,
12/18/2020 0:00,3:38:49,https://twitter.com/skynewsarabia/status/1362245159400964098,,,,بعد إقفال الحضانات ماذا اكتشف الأهل في أطفالهم,
12/22/2020 0:00,11:10:11,https://twitter.com/emaratalyoum/status/1363808298797993985,,,,مشاهد من فعاليات معرض جلفود في مركز دبي التجاري العالمي ويشارك فيه من أبرز العلامات المختصة في قطاع الأغذية لتسليط الضوء على الابتكارات الجديدة في السوق واغتنام التحولات المتسارعة في أنماط سلوكيات المستهلكين الإماراتاليوم,
12/22/2020 0:00,7:25:11,https://twitter.com/emaratalyoum/status/1363751675639472130,,,,إقامة دبي تدشن رسميا مشروع رحلة المسافر الذكي باستخدام بصمة الوجه خلال ثوان مع تطبيق إجراءات الوقاية من كورونا الإماراتاليوم,
2/13/2021 0:00,10:38:59,https://twitter.com/AlArabiya/status/1360538955553374215,,,,وصلت إلى أدنى مستوى لها منذ أكتوبر وكالة الصحافة الفرنسية تراجع في إصابات كورونا حول العالم هذا الأسبوع العربية,
12/13/2020 0:00,15:49:00,https://twitter.com/skynewsarabia/status/1360616973835657219,,,,مبان ومكاتب تهتز شاهد زلزال يضرب فوكوشيما اليابانية بقوة درجة على مقياس ريختر,
2/16/2021 0:00,23:39:06,https://twitter.com/AlArabiya/status/1361822441052524553,,,,نائب مساعد وزير الخارجية الأميركي السابق لشؤون الشرق الأوسط مارك كيميت نأمل في حكمة إدارة بايدن والابتعاد عن نهج أوباما والعمل على تحقيق توازن في المنطقة العربية,
21:31:56,3/6/2021 0:00,,,,,بعد تجربة التطبيق صراحة التطبيق جبار يشتغل القنوات بدون تعليق حتى لو كان النت ضعيف  جربت اليوم كل القنوات سريع وخفيف  موجود قنوات الرياضية وبعض القنوات الاخرى مثل  كلها شغالة بدون تعليق   حملوا التطبيق قبل الحذف,
12/27/2020 0:00,16:32:32,https://twitter.com/emaratalyoum/status/1365701360117829639,,,,فوز التعاون ومصفوت في دوري الدرجة الأولى الإماراتاليوم,
2/13/2021 0:00,12:38:51,https://twitter.com/AlArabiya/status/1360569123894353922,,,,برهم صالح العراق يحتاج إصلاحا شاملا ويجب عدم السماح بتحويل البلاد إلى ساحة لتصفية الحسابات الإقليمية العربية,
2/22/2021 0:00,11:10:27,https://twitter.com/AlArabiya/status/1363808365554638848,,,,مقتل السفير الإيطالي في الكونغو بعد هجوم استهدف قافلة لأم المتحدة شرق البلاد العربية,
12/19/2020 0:00,12:25:16,https://twitter.com/emaratalyoum/status/1362740032809934848,,,,بالفيديو فرحة هستيرية من نيمار بفضيحة برشلونة هل كان سيحتفل لو سجل الإماراتاليوم,
12/2/2020 0:00,9:58:31,https://twitter.com/skynewsarabia/status/1356542508105408517,,,,مدربة تريض وانقلاب على السلطة بخلفها شاهدسكاي ميانمار,
2/20/2021 0:00,23:30:18,https://twitter.com/AlArabiya/status/1363269779314868227,,,,الكويت تمد منع دخول غير الكويتين والخضوع لحجر الإلزامي شرط السماح بدخول المواطنين العربية,
12/23/2020 0:00,4:57:19,https://twitter.com/emaratalyoum/status/1364076853904998403,,,,«إقامة دبي» تختصر رحلة المسافر بصمتي العين والوجه إلى ثوان الإماراتاليوم,
2/15/2021 0:00,10:26:03,https://twitter.com/AlArabiya/status/1361260477024784386,,,,انهيارعقارفيالقاهرة العروس كانت على قيد الحياة تصرخ وأثناء انتشالها انهار باقي المنزل فوقها وقتلها العربية,
12/13/2020 0:00,14:48:56,https://twitter.com/emaratalyoum/status/1360601860202262531,,,,فرنسا هيئة صحية توصي بجرعة لقاح واحدة لمتعافين من كورونا الإماراتاليوم,
2/16/2021 0:00,14:32:16,https://twitter.com/AlArabiya/status/1361684826936520709,,,,بعد حصوله على صلاحيات واسعة من تعديل ماذا يريد أردوغان من الترويج لدستور جديد في هذا التوقيت العربية,
2/14/2021 0:00,1:58:47,https://twitter.com/AlArabiya/status/1360770430425038851,,,,المحل السياسي جواد غوك التأثير التركي واضح في أذربيجان لكن لا يمكن أن يصل لما تشير إليه خريطة النفوذ المزعومة العربية,
12/16/2020 0:00,8:31:34,https://twitter.com/emaratalyoum/status/1361594053884862465,,,,وكالات سيارات تنشط السوق المحلية بطرح طرز جديدة في الإماراتاليوم,
12/13/2020 0:00,5:00:01,https://twitter.com/skynewsarabia/status/1360453651534282753,,,,ديك مراكش المدل زبون فخم على رأسه ريشة,
12/19/2020 0:00,13:48:10,https://twitter.com/AlHadath/status/1362760892358795269,,,,مراسل العربية الشرطة ألقت القبض على الاجئ الذي قتل المسؤول الفرنسي,
12/10/2020 0:00,8:25:18,https://twitter.com/emaratalyoum/status/1359418151491014658,,,,تحذير سويسري من الإفراط في القهوة لأجل صحة المفاصل الإماراتاليوم,
12/9/2020 0:00,15:03:56,https://twitter.com/skynewsarabia/status/1359156083793797125,,,,العرب إلى المريخ بإرادة إماراتية النصف الساعة الحاسمة,
12/21/2020 0:00,10:45:49,https://twitter.com/emaratalyoum/status/1363439780906827776,,,,الموت يفجع الأسطورة رونالدينيو الإماراتاليوم,
12/1/2020 0:00,14:11:34,https://twitter.com/skynewsarabia/status/1366390660199186438,,,,غوتيريس أي خفض لمساعدات ليمن ستكون عواقبه كارثية,
8:46:54,3/2/2021 0:00,,,,,اخسر دهون وليس فقط وزن ارفع لياقتك حسن قوامك غير مقاسات لبسك صغر محيط خصرك تخلص من الدهون العميقة داخل بطنك والوالتي ثبت أنها أم الأمراض الحمية والرياضة تعطيك كل هذا وأكثر,
12/17/2020 0:00,11:27:40,https://twitter.com/skynewsarabia/status/1362000761526362112,,,,أزمة الحدود السودان يستدعي سفيره في إثيوبيا,
12/16/2020 0:00,1:00:18,https://twitter.com/emaratalyoum/status/1361480488997765121,,,,«أحمد» يحتاج إلى جلسة علاج كيماوي ب ألف درهم الإماراتاليوم,
12/23/2020 0:00,15:36:34,https://twitter.com/skynewsarabia/status/1364237723134013440,,,,ديربي الرياض بلسان الجماهير سكايرياضة,
2/18/2021 0:00,13:08:59,https://twitter.com/AlArabiya/status/1362388644410122241,,,,مجلس الأمن يجتمع لبحث تطورات الأزمة اليمنية ومراسل العربية سيطالب الحوثين بوقف التصعيد العسكري في مأرب اليمن العربية,
12/26/2020 0:00,20:00:00,https://twitter.com/skynewsarabia/status/1365391184416428034,,,,شخصيات عالمية تدعو بايدن لدعم قرار الاعتراف بمغربية الصحراء سكايأخبار,
12/27/2020 0:00,21:15:00,https://twitter.com/skynewsarabia/status/1354538420513730567,,,,فوز كان باليد في مونديال اليد كان الأمل بأن يتحق النصر على أرض مصر لكن لرميات الحظ رأي آخر هنيئا لمصر فوزها بمنتخب على مستوى عالمي مصر مونديالاليد شاهدسكاي,
12/28/2020 0:00,8:19:06,https://twitter.com/emaratalyoum/status/1365939570559381505,,,,خدمة طلب تفعيل حساب ضمان الإماراتاليوم,
12/25/2020 0:00,12:55:00,https://twitter.com/skynewsarabia/status/1364921839718264836,,,,شحنة فيروس عالية وطفرة جديدة رضيع أميركي يثير حيرة الأطباء سكايأخبار,
12/27/2020 0:00,14:33:34,https://twitter.com/emaratalyoum/status/1365671422572564484,,,,إخلاء عقار في بريطانيا بسب قنبلة الإماراتاليوم,
12/1/2020 0:00,9:57:41,https://twitter.com/emaratalyoum/status/1366326767254974464,,,,نجوم أحدثوا نقلة نوعية في «الدرجة الأولى» الإماراتاليوم,
11:15:58,12/6/2020 0:00,,,,,ايلتس النجاح يبدأ مع شهاده شهاده معتمده كإثبات لكفاءة الغة الانجليزية لغايات التعليم العالي والهجرة العالميه تواصل معنا الان واحصل علي الان شهادات ايلتس جامعه الكويت جامعه الملك عبدالعزيز جامعات الملكه نوره جامعة الامارات ايلتس,
12/28/2020 0:00,10:20:38,https://twitter.com/emaratalyoum/status/1365970155612831747,,,,مصطفى محمد يتفوق على محمد صلاح بالانطلاقة ويركن فالكاو على الاحتياط الإماراتاليوم,
12/26/2020 0:00,15:45:00,https://twitter.com/skynewsarabia/status/1365327009904291851,,,,قتيلا من فصائل مدعومة من إيران بقصف جوي أميركي سكايأخبار,
12/16/2020 0:00,14:29:42,https://twitter.com/emaratalyoum/status/1361684183253450753,,,,«حمدان الطبية» مليون درهم لتمويل بحثا جديدا الإماراتاليوم,
12/27/2020 0:00,13:36:59,https://twitter.com/emaratalyoum/status/1365657181689950210,,,,إغلاق مساجد في السعودية بعد إصابة شخصا بكورونا الإماراتاليوم,
12/2/2020 0:00,10:02:49,https://twitter.com/emaratalyoum/status/1366690448463527942,,,,فينيسيوس ينقذ الريال من الخسارة وبرشلونة ينفرد بالوصافة الإماراتاليوم,
12/23/2020 0:00,16:56:17,https://twitter.com/AlHadath/status/1364257786717233158,,,,المبعوث الأميركي إلى اليمن يؤكد على ضرورة وقف الحوثين لجميع العمليات العسكرية في مأرب والامتناع عن الأعمال المزعزعة لاستقرار بالبلاد,
12/17/2020 0:00,16:59:11,https://twitter.com/AlHadath/status/1362084186677514240,,,,وزير الخارجية الأميركي أنتوني بلينكن سياسة واشنطن تقضي بعدم السماح ل إيران بامتلاك سلاح نوي وعليها الامتثال لبنود الاتفاق,
12/23/2020 0:00,7:33:49,https://twitter.com/skynewsarabia/status/1364116237886902272,,,,الكاتب المتخص بالشأن الأميركي ياسر الغسلان على الرغم من اختلاف وجهات النظر حول بعض الملفات بين السعودية وأميركا تبقى العلاقات استراتيجية بين البلدين نيرانصديقة مع الحلقة كاملة,
12/11/2020 0:00,1:16:58,https://twitter.com/emaratalyoum/status/1359672744305192964,,,,«عبدالرزاق» يعاني الشفة الأرنبية وعلاجه ب ألف درهم الإماراتاليوم,
1:56:15,3/7/2021 0:00,,,,,قبل الحذف شوف مقطع الى نزلته   معصيتي  رحتي,
12/2/2020 0:00,8:35:05,https://twitter.com/emaratalyoum/status/1366668370263834625,,,,مخاطر انقطاع النفس أثناء النوم بشكل متكر الإماراتاليوم,
2/25/2021 0:00,5:28:51,https://twitter.com/AlHadath/status/1364809563074084865,,,,المبعوث الأميركي يشكر السعودية على المساعدات الإنسانية التي تقدمها ل اليمن,
12/14/2020 0:00,10:40:00,https://twitter.com/skynewsarabia/status/1360901599267348489,,,,رغم طرده لامباراد يقبض ألف إسترليني أسبوعيا سكايأخبار,
12/17/2020 0:00,12:47:21,https://twitter.com/skynewsarabia/status/1362020814393135105,,,,الدراما المصرية هل بات سلاحا فعالا في مواجهة الإرهاب,
12/30/2020 0:00,20:20:00,https://twitter.com/skynewsarabia/status/1355611743137882112,,,,تبديل الارتجاج في البريميرليغ سكايرياضة شاهدسكاي,
2/24/2021 0:00,10:10:29,,,,,وعليكم السلام ورحمة اله عندي مجموعه تنحيف لأطفال عباره عن مكمل غذائي يعمل على تسريع عملية حرق الدهون تعالي خاص بعطي لك حل,
12/21/2020 0:00,6:16:36,https://twitter.com/emaratalyoum/status/1363372026874929158,,,,مباشر افتاح فعاليات الدورة ال من معرضي آيدكس و نافدكس بمشاركة أكثر من شركة الإماراتاليوم,
20:54:48,3/5/2021 0:00,,,,,شاهد قبل الحذف صورة حصرية لطالب فنون تطبيقية في نظر الدكاترة,
12/22/2020 0:00,8:56:17,https://twitter.com/AlHadath/status/1363774600308473856,,,,الاتحاد الأوروبي تعاون إيران مع الوكالة الدولية لطاقة الذكرية حيوي لمستقبل الاتفاقالنوي,
12/25/2020 0:00,11:35:00,https://twitter.com/skynewsarabia/status/1364901707122098179,,,,مسحة كورونا الشرجية والدبلوماسين الأميركين تعليق صيني سكايأخبار,
12/14/2020 0:00,13:42:42,https://twitter.com/AlHadath/status/1360947577567510529,,,,شاهد بالصورة كيف تخزن إيران الأسلحة في مطاردمشق داخل حاويات لأم المتحدة سوريا الحدث,
2/27/2021 0:00,0:59:05,https://twitter.com/AlArabiya/status/1365466448836124676,,,,الضربة الأميركية ضد ميليشيات طهران في سوريا رسالة واضحة ل إيران لرد على هجمات أربيل وبلد وبغداد والرئيس بايدن يحاول القول بوضوح إنه ليس أوباما آخر العربية,
2/19/2021 0:00,18:21:26,https://twitter.com/AlArabiya/status/1362829663316434954,,,,ألمانيا تعهد بتقديم مليار يورو إضافي لتعزيز توفير القاحات لدول الفقيرة العربية,
2/25/2021 0:00,4:34:10,https://twitter.com/AlArabiya/status/1364795801231360002,,,,السيناتور الجمهوري توم كوتون وأكثر من مشرعا جمهوريا آخرين يقدمون قرارا يعارض أي تحرك لرفع العقوبات عن إيران العربية,
12/9/2020 0:00,11:30:17,https://twitter.com/emaratalyoum/status/1359102315639279616,,,,الصحة العالمية انتقال كورونا إلى الإنسان عبر حيوان وسيط الأكثر ترجيحا الإماراتاليوم,
12/15/2020 0:00,8:22:02,https://twitter.com/emaratalyoum/status/1361229266889891840,,,,شرطة أبوظبي تدعو ضمن حملة خلك حذر الأسر إلى مراقبة أبنائهم من الابتزاز الإلكتروني ومن ينتحلون صفة البنات واستدراجهم بصور صداقة ثم التهديد بنشر بياناتهم وصورهم الشخصية عبر القنوات الإلكترونية بهدف الحصول على مكاسب مادية أو معلومات أو رغبات خاصة من الأشخاص أو الشركات بالإكراه,
12/17/2020 0:00,19:04:48,https://twitter.com/emaratalyoum/status/1362115801298386945,,,,إصابات وحريق بسب تصادم مركبتين الإماراتاليوم,
12/27/2020 0:00,9:29:30,https://twitter.com/skynewsarabia/status/1365594902181130241,,,,شتاء عاصف هذا العام غير من شكل حديقة لمنمنمات أوكرانيا,
2/14/2021 0:00,7:38:03,https://twitter.com/AlArabiya/status/1360855809685602306,,,,الاختلاف يسيطر على مجلس النواب في ليبيا مع دعوة رئيس البرلمان عقيلة صالح لجلسة تشاورية بمدينة طبرق شرقا العربية,
12/5/2020 0:00,11:15:00,https://twitter.com/skynewsarabia/status/1357648916724916225,,,,السرطان الأكثر شيوعا دراسة تكشف مفاجأة سكايأخبار,
2/26/2021 0:00,20:13:47,https://twitter.com/AlHadath/status/1365394653156159488,,,,الميليشيات الموالية ل إيران في العراق تعترف بخسائرها في الغارات الأميركية على الحدود مع سوريا,
12/23/2020 0:00,16:45:18,https://twitter.com/AlHadath/status/1364255022205313025,,,,شاهد أفراد من ميليشياتالحوثي يفرون هربا من نيران الجيش اليمني أثناء اقتحامه مواقعهم شرق مديرية نهم اليمن الحدث,
12/30/2020 0:00,17:55:00,https://twitter.com/skynewsarabia/status/1355575252546420736,,,,فيديو اعتقال روسي بسب الشواء على الهيب الأبدي,
12/10/2020 0:00,5:26:33,https://twitter.com/emaratalyoum/status/1359373167534481408,,,,مسبار الأمل فخر اعتزاز دولتي يتصدر تويتر صباح الانجازات يا أغلى وطن مسبارالأملفخراعتزازدولتي مسبارالأمل العربإلىالمريخ لاشيئمستحيل الإماراتاليوم,
12/18/2020 0:00,5:03:32,https://twitter.com/emaratalyoum/status/1362266477060063232,,,,«التجميل المنزلي» يشوه نساء ويصيبهن بأورام حميدة الإماراتاليوم,
2/27/2021 0:00,4:59:49,https://twitter.com/AlHadath/status/1365527033695129601,,,,الأخصائي في الأمراض الصدرية بمستشفى أرباجون باريس دوحيد أحمد التجارب أكدت أن الجرعة الأولى من لقاح فايزر تمنح المصاب ب كورونا مناعة جيدة خلال أول أسابيع,
2/28/2021 0:00,18:44:02,https://twitter.com/AlArabiya/status/1366096840358326279,,,,ول ستريت جورنال دبلوماسيون يؤكدون رفض إيران عرضا لإجراء محادثات نوية مباشرة مع الولايات المتحدة العربية,
12/3/2020 0:00,2:34:38,https://twitter.com/skynewsarabia/status/1356793189156466690,,,,خطوات أولا رد فاتر من واشنطن على اقتراح ظريف النوي سكايأخبار,
12/23/2020 0:00,9:00:00,https://twitter.com/skynewsarabia/status/1364137926498480134,,,,تواصل أعمال معرضي آيديكس و نافدكس في أبوظبي سكايأخبار,
12/2/2020 0:00,8:36:04,https://twitter.com/emaratalyoum/status/1366668618574950401,,,,توفر العجلة امكانية مشاهدة أفق دبي من داخل كبسولة مغلقة بالزجاج وبزاوية درجة على ارتفاع قدم الإماراتاليوم,
12/31/2020 0:00,13:52:14,https://twitter.com/skynewsarabia/status/1355876545458544640,,,,ياسمينةخضرا الجزائر عاشت مرحلة صعبة في التسعينيات وأنا واثق بأن هذه التجربة لن تكر حديثالعربسكاي مع الحلقة كاملة,
12/8/2020 0:00,21:46:04,https://twitter.com/skynewsarabia/status/1358894893599502337,,,,فاوتشي هذه هي أفضل طريقة لمحاربة سلالات كورونا,
12/13/2020 0:00,21:15:00,https://twitter.com/skynewsarabia/status/1360699014304329728,,,,أردوغان يقوض فرص التهدئة في ليبيا ويحشد مزيد من المرتزقة,
12/10/2020 0:00,12:18:35,https://twitter.com/skynewsarabia/status/1359476859294142464,,,,بعد مكاسب أسعار النفطهل نجحت استراتيجية أوبك شاهدسكاي سكاياقتصاد,
12/1/2020 0:00,20:52:07,https://twitter.com/skynewsarabia/status/1366491462498725890,,,,شركة خاصة تيح خدمة تحريك صور الراحلين مجانا منصات شاهدسكاي,
12/3/2020 0:00,23:00:22,https://twitter.com/skynewsarabia/status/1357101653778956293,,,,برشلونة يبلغ نهائي كأس إسبانيا بعد ريمونتادا مثيرة سكايرياضة,
2/22/2021 0:00,6:02:10,https://twitter.com/AlArabiya/status/1363730782502666249,,,,التحالف الدولي ل العربيةنت ملتزمون بهزيمة بقايا داعش في سوريا ومهمتنا لن تغير مع وصول الرئيس الأميركي جو بايدن إلى البيت الأبيض العربية,
12/14/2020 0:00,9:00:00,https://twitter.com/skynewsarabia/status/1360876435179773955,,,,تبرئة ترامب أمام مجلس الشيوخ شاهدسكاي,
2/17/2021 0:00,0:54:54,,,,,اساعد كم عيله في سوريا بالخميات,
12/7/2020 0:00,4:03:18,https://twitter.com/skynewsarabia/status/1358265054026731520,,,,تفاصيل مشروع قانون منتظر بالبرلمان المصري,
2/27/2021 0:00,5:59:14,https://twitter.com/AlArabiya/status/1365541986825027589,,,,استطلاع لرأي من الأميركين يحدون أولوية إدارة بايدن في حماية الوظائف ثم الحد من انتشار الأمراض المعدية ومقاومة الإرهاب العربية,
2/25/2021 0:00,22:49:08,https://twitter.com/AlArabiya/status/1365071361077567490,,,,مختبر الأبحاث التابع لقوات الجوية الأميركية يطور وسائل لشفاء جروح البشر بسرعة تجاوز أضعاف المعدل الطبيعي العربية,
12/9/2020 0:00,13:14:57,https://twitter.com/emaratalyoum/status/1359128654312333316,,,,بدء توافد الإعلامين والحضور لمتابعة النقل المباشر لدخول مسبار الأمل إلى مدار المريخ مسبارالأمل العربإلىالمريخ لاشيئمستحيل الإمارات الحدثالتاريخي الإماراتاليوم,
2/27/2021 0:00,3:44:11,https://twitter.com/AlArabiya/status/1365507999876399106,,,,أوصت لجنة من الخبراء بإجماع أعضائها الجمعة بالاستخدام الطارئ في الولايات المتحدة ل لقاحجونسونآندجونسون ذي الجرعة الواحدة والمضاد ل كوفيد لأشخاص الذين تزيد أعمارهم على عاما العربية,
